url,Datetime,Tweet Id,Text,Retweet Count,Reply Count,Like Count,Username,Display Name,Followers Count,Friends Count,Rendered Content,Day,Month,Year
https://twitter.com/akin_ocal_dev/status/1493244423878160387,2022-02-14 15:23:08+00:00,1493244423878160387,Why product naming matters : UberEat`s Superbowl ad https://t.co/I2PnNLqhgz,1,0,1,akin_ocal_dev,Akin Ocal,27,10,Why product naming matters : UberEat`s Superbowl ad youtube.com/watch?v=Ri-rXP…,14,2,2022
https://twitter.com/DiscussingFilm/status/1493024399901040647,2022-02-14 00:48:50+00:00,1493024399901040647,Gwyneth Paltrow tries to eat(?) her vagina candle in a new Uber Eats advert for #SuperBowl https://t.co/BhJkJbRgKZ,541,253,5518,DiscussingFilm,DiscussingFilm,418452,825,Gwyneth Paltrow tries to eat(?) her vagina candle in a new Uber Eats advert for #SuperBowl https://t.co/BhJkJbRgKZ,14,2,2022
https://twitter.com/CreativeT_Art/status/1493023419599753219,2022-02-14 00:44:56+00:00,1493023419599753219,I just saw Gwyneth Paltrow eat herself out during an uber eats commercial at the Super Bowl... 2022 is gonna have Menence to Society Energy. #SuperBowl,1,0,3,CreativeT_Art,CreativeTemporary (Eclipse of Fire Productions),698,5000,I just saw Gwyneth Paltrow eat herself out during an uber eats commercial at the Super Bowl... 2022 is gonna have Menence to Society Energy. #SuperBowl,14,2,2022
https://twitter.com/TheHand0fThrawn/status/1493023166549090310,2022-02-14 00:43:56+00:00,1493023166549090310,Did the Uber Eats commercial just have Gwyneth Paltrow eat her own Vagina Candle??? #SuperBowl,1,0,2,TheHand0fThrawn,Matthew Mahaney,206,592,Did the Uber Eats commercial just have Gwyneth Paltrow eat her own Vagina Candle??? #SuperBowl,14,2,2022
https://twitter.com/bffatima/status/1493022894821195782,2022-02-14 00:42:51+00:00,1493022894821195782,The fact that the Uber eats advertisement needs to claim that things are ‘prop food’ and that people shouldn’t be eating say pencils and cat litter is exactly why we’re in the pandemic 2 years later.  Don’t get vaccinated but eat dishwashing detergent 🙃 #SuperBowl,1,0,5,bffatima,bff,524,154,"The fact that the Uber eats advertisement needs to claim that things are ‘prop food’ and that people shouldn’t be eating say pencils and cat litter is exactly why we’re in the pandemic 2 years later. 
Don’t get vaccinated but eat dishwashing detergent 🙃 #SuperBowl",14,2,2022
https://twitter.com/DanProft/status/1492985028837621760,2022-02-13 22:12:23+00:00,1492985028837621760,Trying to decide whether to cover my eyes and ears for Gwyneth Paltrow's Uber Eats #SuperBowl ad or wait to eat until after it airs. #superbowlads,1,4,36,DanProft,Dan Proft,20570,448,Trying to decide whether to cover my eyes and ears for Gwyneth Paltrow's Uber Eats #SuperBowl ad or wait to eat until after it airs. #superbowlads,13,2,2022
