url,Datetime,Tweet Id,Text,Retweet Count,Reply Count,Like Count,Username,Display Name,Followers Count,Friends Count,Rendered Content,Day,Month,Year
https://twitter.com/ohthatsNajee22/status/1491981418607513602,2022-02-11 03:44:24+00:00,1491981418607513602,"This tax season, meet YOUR match with @TurboTax! Check out TurboTax Live Full Service and get matched with an expert to do your taxes for you. #MyTurboTaxMatch #TurboTaxLiveFullService #ad https://t.co/uKny2zwlpP",9,13,187,ohthatsNajee22,Najee Harris,197263,462,"This tax season, meet YOUR match with @TurboTax! Check out TurboTax Live Full Service and get matched with an expert to do your taxes for you. #MyTurboTaxMatch #TurboTaxLiveFullService #ad https://t.co/uKny2zwlpP",11,2,2022
https://twitter.com/Toxins_Host/status/1491969221756084226,2022-02-11 02:55:56+00:00,1491969221756084226,If turbotax sends me one more email telling me to get a headstart on filing for this year I'm just gonna commit tax fraud,1,0,2,Toxins_Host,God's Funniest Clown,132,205,If turbotax sends me one more email telling me to get a headstart on filing for this year I'm just gonna commit tax fraud,11,2,2022
https://twitter.com/poisonmemommmy/status/1491962713697886210,2022-02-11 02:30:04+00:00,1491962713697886210,fuck turbo tax for charging me $167 to file my taxes with them why am i being punished even further for paying taxes,1,3,6,poisonmemommmy,kate,1565,1741,fuck turbo tax for charging me $167 to file my taxes with them why am i being punished even further for paying taxes,11,2,2022
https://twitter.com/adland/status/1491958469838053378,2022-02-11 02:13:13+00:00,1491958469838053378,TurboTax Live “Matchmaker” (2022) :45 (USA) #sbads #adland #SBLVI https://t.co/UiSBUDhriJ https://t.co/E9hExs2X2Y,1,0,4,adland,adland ®,86201,14755,TurboTax Live “Matchmaker” (2022) :45 (USA) #sbads #adland #SBLVI adland.tv/adnews/turbota… https://t.co/E9hExs2X2Y,11,2,2022
https://twitter.com/LVSchroeder/status/1491958380583346178,2022-02-11 02:12:51+00:00,1491958380583346178,@turbotax @TeamTurboTax It looks like I'm not the only Marylander who can't file their taxes due to form 8582. The form is available on the IRS website and I understand a fix was promised today. Any idea when this will be resolved?,1,2,1,LVSchroeder,Daniel Owens,12,126,@turbotax @TeamTurboTax It looks like I'm not the only Marylander who can't file their taxes due to form 8582. The form is available on the IRS website and I understand a fix was promised today. Any idea when this will be resolved?,11,2,2022
https://twitter.com/turbotax/status/1491949618657062915,2022-02-11 01:38:02+00:00,1491949618657062915,@YbgShock @YbgShock knows what's up 😉,1,0,1,turbotax,Intuit TurboTax,63200,927,@YbgShock @YbgShock knows what's up 😉,11,2,2022
https://twitter.com/BJaxx22/status/1491945409064882177,2022-02-11 01:21:19+00:00,1491945409064882177,Nah that number can’t be right. Y’all are tripping lol @turbotax https://t.co/YtVS6Qxn9L,1,1,1,BJaxx22,B,438,490,Nah that number can’t be right. Y’all are tripping lol @turbotax https://t.co/YtVS6Qxn9L,11,2,2022
https://twitter.com/NonchalantSi/status/1491944377199075329,2022-02-11 01:17:13+00:00,1491944377199075329,Turbo Tax said my refund would only be $17. I almost threw my damn phone 😭🤦🏾‍♀️,1,0,2,NonchalantSi,The Problem 🌚,3138,2378,Turbo Tax said my refund would only be $17. I almost threw my damn phone 😭🤦🏾‍♀️,11,2,2022
https://twitter.com/OliveOlayy/status/1491938748367523841,2022-02-11 00:54:51+00:00,1491938748367523841,The fear I feel about committing tax fraud on accident is astronomical. But Ima still use turbo tax and figure it out lmao,1,1,14,OliveOlayy,Olivia 🥵,4589,2372,The fear I feel about committing tax fraud on accident is astronomical. But Ima still use turbo tax and figure it out lmao,11,2,2022
