url,Datetime,Tweet Id,Text,Retweet Count,Reply Count,Like Count,Username,Display Name,Followers Count,Friends Count,Rendered Content,Day,Month,Year
https://twitter.com/RasterlyRock/status/1492644561998385152,2022-02-12 23:39:30+00:00,1492644561998385152,@JasonYanowitz Also:  - Binance - OpenSea - Meta - TurboTax  + BAYC and other NFTs in the halftime show 🖼🏟,5,2,64,RasterlyRock,Ryan Rasmussen,2087,1270,"@JasonYanowitz Also:

- Binance
- OpenSea
- Meta
- TurboTax

+ BAYC and other NFTs in the halftime show 🖼🏟",12,2,2022
https://twitter.com/Adweek/status/1492634624467648514,2022-02-12 23:00:00+00:00,1492634624467648514,"Did you know that Ted Lasso is actually just a freelancer and a crypto investor in a trench coat? Well, that's not exactly it, but there are definitely some curious costume (and skin) changes in @TurboTax's #SuperBowl ad all about the brand's adaptability. https://t.co/9TSGFf3BhL",1,0,4,Adweek,Adweek,688977,26488,"Did you know that Ted Lasso is actually just a freelancer and a crypto investor in a trench coat? Well, that's not exactly it, but there are definitely some curious costume (and skin) changes in @TurboTax's #SuperBowl ad all about the brand's adaptability.
adweek.it/3BhjzuR",12,2,2022
https://twitter.com/brgridiron/status/1492619524142731267,2022-02-12 22:00:00+00:00,1492619524142731267,Aaron Donald is ready for Super Bowl Sunday 💍 @TurboTax https://t.co/JYDhpNK0nn,141,14,1212,brgridiron,B/R Gridiron,693688,1118,Aaron Donald is ready for Super Bowl Sunday 💍 @TurboTax https://t.co/JYDhpNK0nn,12,2,2022
https://twitter.com/BleacherReport/status/1492619522980802560,2022-02-12 22:00:00+00:00,1492619522980802560,Aaron Donald wants his SB 💍 @turbotax https://t.co/XXW0qxEWNB,77,26,1279,BleacherReport,Bleacher Report,11461644,719,Aaron Donald wants his SB 💍 @turbotax https://t.co/XXW0qxEWNB,12,2,2022
https://twitter.com/sdierauf/status/1492617744050757644,2022-02-12 21:52:56+00:00,1492617744050757644,Is there literally anything thirstier than turbotax,1,4,15,sdierauf,Stefan Dierauf,907,666,Is there literally anything thirstier than turbotax,12,2,2022
https://twitter.com/glasswolf54/status/1492604045000953862,2022-02-12 20:58:30+00:00,1492604045000953862,Hey @turbotax you may want to fix this transmission not available error that everyone is getting,1,1,3,glasswolf54,🔴⚪️4life,1559,721,Hey @turbotax you may want to fix this transmission not available error that everyone is getting,12,2,2022
https://twitter.com/csbritt63/status/1492601574576820231,2022-02-12 20:48:41+00:00,1492601574576820231,Spent close to 1 hour doing my grandgirl's taxes on Turbo Tax (which isn't free this year) only to get to the very end &amp; it says $29 to file fed and $39 to file state😳 I'm like WTF did I click?? Cleared it all &amp; will start over tomorrow a.m. I am stressed af😱,1,6,11,csbritt63,Cindy B.,9013,7605,Spent close to 1 hour doing my grandgirl's taxes on Turbo Tax (which isn't free this year) only to get to the very end &amp; it says $29 to file fed and $39 to file state😳 I'm like WTF did I click?? Cleared it all &amp; will start over tomorrow a.m. I am stressed af😱,12,2,2022
https://twitter.com/theonlybrenbren/status/1492596234904748033,2022-02-12 20:27:28+00:00,1492596234904748033,Idk about y’all but the turbo in turbotax ain’t turboing,1,0,1,theonlybrenbren,Bren Bren,63,143,Idk about y’all but the turbo in turbotax ain’t turboing,12,2,2022
https://twitter.com/firstwefeast/status/1492589371656052736,2022-02-12 20:00:11+00:00,1492589371656052736,"TOMORROW we’re kicking the Big Game off w/ a special #HotOnes Truth or Dab!   We got @BuffaloBills wide receivers’ @gabedavis011 and @zee_thoven who will each have two choices: Tell the truth, or suffer the wrath of the Last Dab. Tune in at 11 AM ET. 🏈🔥 Presented by @TurboTax https://t.co/O5LEqHbRNo",8,1,33,firstwefeast,First We Feast,304464,1076,"TOMORROW we’re kicking the Big Game off w/ a special #HotOnes Truth or Dab! 

We got @BuffaloBills wide receivers’ @gabedavis011 and @zee_thoven who will each have two choices: Tell the truth, or suffer the wrath of the Last Dab. Tune in at 11 AM ET. 🏈🔥
Presented by @TurboTax https://t.co/O5LEqHbRNo",12,2,2022
https://twitter.com/Alvin1k_/status/1492586407214391296,2022-02-12 19:48:25+00:00,1492586407214391296,TurboTax really spamming niggas at this point,2,0,4,Alvin1k_,.,5249,5009,TurboTax really spamming niggas at this point,12,2,2022
https://twitter.com/YouGottaB_Mad/status/1492571257195302913,2022-02-12 18:48:13+00:00,1492571257195302913,Don’t use TurboTax yall! Use https://t.co/XGvKm9SWLy ❕ It’s way better and doesn’t add all the extra fees!,1,0,1,YouGottaB_Mad,Quay Moonre®️| Herstory |,2650,901,Don’t use TurboTax yall! Use freetaxusa.com ❕ It’s way better and doesn’t add all the extra fees!,12,2,2022
https://twitter.com/turbotax/status/1492554912206626817,2022-02-12 17:43:16+00:00,1492554912206626817,"When it comes to football reporting, @ErinAndrews is the expert. 🏈🎤 And when it comes to taxes, we’ve got the experts. 💰  Get matched with one of our TurboTax Live experts and let them do your taxes for you. https://t.co/aETIO5rixY #MyTurboTaxMatch @BookCameo https://t.co/cIUndlJsgT",13,2,81,turbotax,Intuit TurboTax,63200,927,"When it comes to football reporting, @ErinAndrews is the expert. 🏈🎤 And when it comes to taxes, we’ve got the experts. 💰

Get matched with one of our TurboTax Live experts and let them do your taxes for you. intuit.me/3rHIXXt #MyTurboTaxMatch @BookCameo https://t.co/cIUndlJsgT",12,2,2022
https://twitter.com/shadowconn/status/1492548266424258561,2022-02-12 17:16:51+00:00,1492548266424258561,And lie and lie and lie and lie and lie lie lie lie lie lie lie lie lie. Does this look free to you. #Scam #turbotax https://t.co/2UdghzwKrI,1,2,2,shadowconn,Stacey Carroll,25234,25929,And lie and lie and lie and lie and lie lie lie lie lie lie lie lie lie. Does this look free to you. #Scam #turbotax https://t.co/2UdghzwKrI,12,2,2022
https://twitter.com/Downriver5/status/1492539185265217538,2022-02-12 16:40:46+00:00,1492539185265217538,"Don't use TurboTax for Oregon income tax returns until around or after Feb 18, it will be rejected by the State. https://t.co/sNSv0vRxq6",1,3,4,Downriver5,Downriver,2558,2785,"Don't use TurboTax for Oregon income tax returns until around or after Feb 18, it will be rejected by the State. https://t.co/sNSv0vRxq6",12,2,2022
https://twitter.com/turbotax/status/1492529428752216066,2022-02-12 16:02:00+00:00,1492529428752216066,"What you have to do: click the link and scratch. What you could win: $500 cash, TurboTax product codes, or $100 digital gift cards for the NFL Shop. Enter now. #MyTurboTaxMatch #Sweepstakes",2,2,29,turbotax,Intuit TurboTax,63200,927,"What you have to do: click the link and scratch. What you could win: $500 cash, TurboTax product codes, or $100 digital gift cards for the NFL Shop. Enter now. #MyTurboTaxMatch #Sweepstakes",12,2,2022
https://twitter.com/MrThugChip/status/1492520336121901061,2022-02-12 15:25:52+00:00,1492520336121901061,adding turbotax case manager to my resume #igetabagyougetabag,1,1,4,MrThugChip,Chip Bussdown 🍪,430,533,adding turbotax case manager to my resume #igetabagyougetabag,12,2,2022
https://twitter.com/CoinDesk/status/1492488664647090178,2022-02-12 13:20:01+00:00,1492488664647090178,"In the most recent episode of #NFTAllStars, sponsored by @turbotax, we talked to @FEWOCiOUS about his journey as an NFT artist.   Catch the episode on https://t.co/yHMYaDyzNy: https://t.co/u4sk1PMbMa  Got any questions about NFTs? Text 'em to (507) 4787-NFT. https://t.co/CGrUhbljIR",43,110,129,CoinDesk,CoinDesk,2824525,1483,"In the most recent episode of #NFTAllStars, sponsored by @turbotax, we talked to @FEWOCiOUS about his journey as an NFT artist. 

Catch the episode on CoinDesk.TV: bit.ly/3Gg1huU

Got any questions about NFTs? Text 'em to (507) 4787-NFT. https://t.co/CGrUhbljIR",12,2,2022
https://twitter.com/G6Commo/status/1492456709226438657,2022-02-12 11:13:02+00:00,1492456709226438657,Taxes #DONE. My first #PSG got me hooked on @turbotax - #NCOs #backboneofthearmy,1,0,0,G6Commo,May the Comms be with you #lightsaber🌻,91,143,Taxes #DONE. My first #PSG got me hooked on @turbotax - #NCOs #backboneofthearmy,12,2,2022
https://twitter.com/Lil_Mom_of_4/status/1492376730727854082,2022-02-12 05:55:14+00:00,1492376730727854082,@Heathersauer123 @TeamTurboTax @turbotax @creditkarma Y’all go check your refunds going through sbtpg. They’re taking out extra fees also!,1,3,1,Lil_Mom_of_4,Carrie Alexander,29,122,@Heathersauer123 @TeamTurboTax @turbotax @creditkarma Y’all go check your refunds going through sbtpg. They’re taking out extra fees also!,12,2,2022
https://twitter.com/VexxVixen/status/1492314113904676866,2022-02-12 01:46:25+00:00,1492314113904676866,I just saw a TurboTax ad promoting crypto and it’s the most cursed sounding thing,2,1,4,VexxVixen,Vexx Vixen,163,462,I just saw a TurboTax ad promoting crypto and it’s the most cursed sounding thing,12,2,2022
https://twitter.com/_VeeChi/status/1492284573526503428,2022-02-11 23:49:02+00:00,1492284573526503428,TurboTax harassing me at this point,1,0,2,_VeeChi,.,1514,247,TurboTax harassing me at this point,11,2,2022
https://twitter.com/davrycrostack/status/1492279955849314311,2022-02-11 23:30:41+00:00,1492279955849314311,I go once-in-a-lifetime-mode when TurboTax asks me about my beautiful house and beautiful wife,1,1,6,davrycrostack,stomach,61,298,I go once-in-a-lifetime-mode when TurboTax asks me about my beautiful house and beautiful wife,11,2,2022
https://twitter.com/Bea_latina/status/1492278812372996097,2022-02-11 23:26:08+00:00,1492278812372996097,Love this campaign we are doing with @turbotax  100% in culture... All Latin@s remember the plastic in our abuela's sofa! https://t.co/RRIo2qjxuq,1,2,11,Bea_latina,BeatrizAcevedo,4856,567,"Love this campaign we are doing with @turbotax 
100% in culture... All Latin@s remember the plastic in our abuela's sofa! twitter.com/wearesuma/stat…",11,2,2022
https://twitter.com/Jumpmankellz/status/1492275471433748488,2022-02-11 23:12:52+00:00,1492275471433748488,@_Venquie Turbotax 😄,1,1,1,Jumpmankellz,Brandon Kelley,76,160,@_Venquie Turbotax 😄,11,2,2022
https://twitter.com/Vevo/status/1492273995223232516,2022-02-11 23:07:00+00:00,1492273995223232516,"This year's halftime show is going to be one to remember 🏉  From Snoop and Kendrick to Alicia Keys and Shakira, get hyped with our playlist featuring both Sunday's stars and previous performers.   Sponsored by: @TurboTax ⠀⠀⠀⠀⠀⠀⠀⠀⠀ ▶️https://t.co/bYtUh9Slx8 https://t.co/w5l9eFZ7Pm",4,1,28,Vevo,Vevo,4028047,4438,"This year's halftime show is going to be one to remember 🏉  From Snoop and Kendrick to Alicia Keys and Shakira, get hyped with our playlist featuring both Sunday's stars and previous performers. 

Sponsored by: @TurboTax
⠀⠀⠀⠀⠀⠀⠀⠀⠀
▶️youtube.com/watch?v=mwP2LX… https://t.co/w5l9eFZ7Pm",11,2,2022
https://twitter.com/SoleNotSoul/status/1492270391716417536,2022-02-11 22:52:41+00:00,1492270391716417536,You gotta follow this tweet up with an alternative to TurboTax https://t.co/TORbZhWZV5,1,1,3,SoleNotSoul,Key 🔑,974,859,You gotta follow this tweet up with an alternative to TurboTax twitter.com/TheGreatPatsb/…,11,2,2022
https://twitter.com/TheGreatPatsb/status/1492254821738504198,2022-02-11 21:50:48+00:00,1492254821738504198,Aye let me tell you this lmao. If you are still using TurboTax to file your taxes you are legit an idiot.,2,2,3,TheGreatPatsb,evil morty,1249,896,Aye let me tell you this lmao. If you are still using TurboTax to file your taxes you are legit an idiot.,11,2,2022
https://twitter.com/CoinDesk/status/1492236591774978052,2022-02-11 20:38:22+00:00,1492236591774978052,"Have you caught our new animated talk show #NFTAllStars yet?  Last week we had @peteholmes on to talk about how he's using the technology in the comedy space.  Watch the full episode, sponsored by @turbotax on @THETAtv or https://t.co/yHMYaDyzNy: https://t.co/PCeyr3Fspm https://t.co/RK1ZA4olVe",7,27,38,CoinDesk,CoinDesk,2824526,1483,"Have you caught our new animated talk show #NFTAllStars yet?

Last week we had @peteholmes on to talk about how he's using the technology in the comedy space.

Watch the full episode, sponsored by @turbotax on @THETAtv or CoinDesk.TV: bit.ly/3sf28XP https://t.co/RK1ZA4olVe",11,2,2022
https://twitter.com/wearesuma/status/1492230489985347585,2022-02-11 20:14:07+00:00,1492230489985347585,"If you have what it takes to wait until you can sit in the good furniture, then you have what it takes to #invest. 🙌 The longer you hold onto a stock, the less in #taxes you pay. Want to know more? Use @Turbotax's Capital Gains Tax Calculator https://t.co/IkQFulUifE  #sponsored https://t.co/ketTqlGf05",3,0,6,wearesuma,Suma Wealth,1694,97,"If you have what it takes to wait until you can sit in the good furniture, then you have what it takes to #invest. 🙌 The longer you hold onto a stock, the less in #taxes you pay. Want to know more? Use @Turbotax's Capital Gains Tax Calculator intuit.me/3gHcPwU 
#sponsored https://t.co/ketTqlGf05",11,2,2022
https://twitter.com/JStaatsCPA/status/1492224428456890370,2022-02-11 19:50:02+00:00,1492224428456890370,"I AM TICKLED TO SHARE IN HONOR OF SUNDAY'S SPORTS BOWL  I made a video with a few of #taxtwitter's finest @NayoCarterGray  @adammarkowitzEA  @AccountingAsArt  @BlakeTOliver   ""Accounting Professionals React To TurboTax Commercials"" https://t.co/FOPyxK70Kw",12,23,127,JStaatsCPA,Jason Staats 🔨,7221,209,"I AM TICKLED TO SHARE IN HONOR OF SUNDAY'S SPORTS BOWL

I made a video with a few of #taxtwitter's finest
@NayoCarterGray 
@adammarkowitzEA 
@AccountingAsArt 
@BlakeTOliver 

""Accounting Professionals React To TurboTax Commercials"" https://t.co/FOPyxK70Kw",11,2,2022
https://twitter.com/tanoaksam/status/1492222875583062018,2022-02-11 19:43:52+00:00,1492222875583062018,For those who want to know more about TurboTax’s tomfoolery: https://t.co/Wvlk9yy3x3,2,0,14,tanoaksam,Sam Sycamore 🌲,29361,803,For those who want to know more about TurboTax’s tomfoolery: propublica.org/article/inside…,11,2,2022
https://twitter.com/tanoaksam/status/1492221332825726976,2022-02-11 19:37:44+00:00,1492221332825726976,"PSA: TurboTax is THE reason why our tax filing system in the US is a Kafkaesque horror show.   They literally take the money that you pay them and use it to lobby against any and all changes that would potentially simplify the tax code, and thus render them irrelevant.",2,1,30,tanoaksam,Sam Sycamore 🌲,29361,803,"PSA: TurboTax is THE reason why our tax filing system in the US is a Kafkaesque horror show. 

They literally take the money that you pay them and use it to lobby against any and all changes that would potentially simplify the tax code, and thus render them irrelevant.",11,2,2022
https://twitter.com/tanoaksam/status/1492220875260764173,2022-02-11 19:35:55+00:00,1492220875260764173,"Not TurboTax in my mentions trying to redirect people away from free tax prep services 🤦‍♂️   No matter how you choose to file your taxes, please just don’t use TurboTax.",3,5,62,tanoaksam,Sam Sycamore 🌲,29361,803,"Not TurboTax in my mentions trying to redirect people away from free tax prep services 🤦‍♂️ 

No matter how you choose to file your taxes, please just don’t use TurboTax.",11,2,2022
https://twitter.com/comedindian/status/1492216923941216258,2022-02-11 19:20:13+00:00,1492216923941216258,Reminder ‼️ This tax szn:  Do NOT blame the IRS for not telling you how much your taxes are and making you pay to file them!  DO blame the tax prep corporations that are LOBBYING to keep themselves in business!  @turbotax @HRBlock @TaxAct @TaxSlayer @ezTaxReturn,1,0,11,comedindian,reebillionaire,300,293,"Reminder ‼️ This tax szn:

Do NOT blame the IRS for not telling you how much your taxes are and making you pay to file them!

DO blame the tax prep corporations that are LOBBYING to keep themselves in business!

@turbotax @HRBlock @TaxAct @TaxSlayer @ezTaxReturn",11,2,2022
https://twitter.com/RLtha2nd/status/1492210908176732163,2022-02-11 18:56:19+00:00,1492210908176732163,"@_Venquie If you Got a simple one, just use turbo tax. It walks you through every step",1,1,1,RLtha2nd,Rob,135,234,"@_Venquie If you Got a simple one, just use turbo tax. It walks you through every step",11,2,2022
https://twitter.com/oscarlindstrom6/status/1492210170914615299,2022-02-11 18:53:23+00:00,1492210170914615299,@SLady1961 @AmyCook1221 Turbo tax or tax act is usually free if they are not complicated. That's the way it sounds for your daughter.,1,2,1,oscarlindstrom6,ogl,1416,1893,@SLady1961 @AmyCook1221 Turbo tax or tax act is usually free if they are not complicated. That's the way it sounds for your daughter.,11,2,2022
https://twitter.com/digital_languor/status/1492198893114646529,2022-02-11 18:08:34+00:00,1492198893114646529,Wow TAXES I can’t wait to pay my TAXES it is so fun to pay my TAXES with TURBOTAX   (this post has been sponsored by the IRS),1,0,2,digital_languor,💾,360,688,"Wow TAXES I can’t wait to pay my TAXES it is so fun to pay my TAXES with TURBOTAX 

(this post has been sponsored by the IRS)",11,2,2022
https://twitter.com/Vairix_/status/1492197559141638160,2022-02-11 18:03:16+00:00,1492197559141638160,turbotax said i was gonna owe so guess who isnt filing this year 😋💸,1,2,21,Vairix_,dav 😵‍💫,695,606,turbotax said i was gonna owe so guess who isnt filing this year 😋💸,11,2,2022
https://twitter.com/AskForTaxAdvice/status/1492192049587707921,2022-02-11 17:41:22+00:00,1492192049587707921,"The worst part about doing your own taxes is all the time it takes reading instructions and wondering if you are getting it right.  If you use TurboTax, follow along with me as I quickly walk through almost every module.  Save hours and headache!  https://t.co/IfqaPBt1hG",1,0,9,AskForTaxAdvice,Patrick the Tax Advisor 🔥,17648,406,"The worst part about doing your own taxes is all the time it takes reading instructions and wondering if you are getting it right.

If you use TurboTax, follow along with me as I quickly walk through almost every module.

Save hours and headache!

askfortaxadvice.gumroad.com/l/EWcXP",11,2,2022
https://twitter.com/turbotax/status/1492190777279139845,2022-02-11 17:36:19+00:00,1492190777279139845,TurboTax Live + the @NFL = the perfect match. We’re proud to sponsor the NFL and hope you’re looking forward to kick off as much as we are! #MyTurboTaxMatch #SBLVI #SuperBowl https://t.co/Y8TTs9MWaT,3,3,11,turbotax,Intuit TurboTax,63200,927,TurboTax Live + the @NFL = the perfect match. We’re proud to sponsor the NFL and hope you’re looking forward to kick off as much as we are! #MyTurboTaxMatch #SBLVI #SuperBowl https://t.co/Y8TTs9MWaT,11,2,2022
https://twitter.com/CoinDesk/status/1492181743327141889,2022-02-11 17:00:25+00:00,1492181743327141889,"LIVE on ""The Hash"": @intel enters the #bitcoin mining market with an energy-efficient GPU, Hungary calls for EU ban on crypto, unpacking the U.S. Senate's Earn It Act bill and more  Watch on https://t.co/yHMYaDyzNy, presented by @turbotax: https://t.co/TCPs8oKjDX",10,16,42,CoinDesk,CoinDesk,2824526,1483,"LIVE on ""The Hash"": @intel enters the #bitcoin mining market with an energy-efficient GPU, Hungary calls for EU ban on crypto, unpacking the U.S. Senate's Earn It Act bill and more

Watch on CoinDesk.TV, presented by @turbotax: twitter.com/i/broadcasts/1…",11,2,2022
https://twitter.com/Vevo/status/1492181644265943040,2022-02-11 17:00:02+00:00,1492181644265943040,"This year's halftime show is going to be one to remember 🏉  From Snoop and Kendrick to Alicia Keys and Shakira, get hyped with our playlist featuring both Sunday's stars and previous performers.   Sponsored by: @TurboTax ⠀⠀⠀⠀⠀⠀⠀⠀⠀ ▶️https://t.co/bYtUh9Slx8 https://t.co/IGg0Xxauu6",3,0,28,Vevo,Vevo,4028047,4438,"This year's halftime show is going to be one to remember 🏉  From Snoop and Kendrick to Alicia Keys and Shakira, get hyped with our playlist featuring both Sunday's stars and previous performers. 

Sponsored by: @TurboTax
⠀⠀⠀⠀⠀⠀⠀⠀⠀
▶️youtube.com/watch?v=mwP2LX… https://t.co/IGg0Xxauu6",11,2,2022
https://twitter.com/CoinDesk/status/1492178417936224258,2022-02-11 16:47:12+00:00,1492178417936224258,"NFT artist @littlejnewyork joins us to host #NFTAllStars, sponsored by @turbotax.  This week's episode features @FEWOCiOUS, another artist in the space. Catch the episode on https://t.co/yHMYaDyzNy: https://t.co/u4sk1PMbMa  Text us your questions about NFTs to (507) 4787-NFT. https://t.co/6bbrZnE958",15,36,41,CoinDesk,CoinDesk,2824526,1483,"NFT artist @littlejnewyork joins us to host #NFTAllStars, sponsored by @turbotax.

This week's episode features @FEWOCiOUS, another artist in the space. Catch the episode on CoinDesk.TV: bit.ly/3Gg1huU

Text us your questions about NFTs to (507) 4787-NFT. https://t.co/6bbrZnE958",11,2,2022
https://twitter.com/calvinjohnsonjr/status/1492163329317613569,2022-02-11 15:47:15+00:00,1492163329317613569,"Sunday football + family time = my perfect match! This tax season, meet YOUR match with @TurboTax. Check out TurboTax Live Full Service and get matched with an expert to do your taxes for you. #MyTurboTaxMatch #TurboTaxLiveFullService #ad https://t.co/6wDx8PZm7V",9,5,71,calvinjohnsonjr,Calvin Johnson Jr.,101339,204,"Sunday football + family time = my perfect match! This tax season, meet YOUR match with @TurboTax. Check out TurboTax Live Full Service and get matched with an expert to do your taxes for you. #MyTurboTaxMatch #TurboTaxLiveFullService #ad https://t.co/6wDx8PZm7V",11,2,2022
https://twitter.com/pixielauren/status/1492150238907412485,2022-02-11 14:55:14+00:00,1492150238907412485,I see H&amp;R Block has paid to promote the #DIYwithBlock hashtag 🙄 so this is your friendly reminder that these craven corporate ghouls are tricking you into paying for things you're entitled to for free if you earn less than $73K.  @turbotax @HRBlock @ezTaxReturn   A thread! 1/?,2,3,0,pixielauren,Lauren is dreaming of wilderness 🌈 🍀 🐱 🍄,408,1668,"I see H&amp;R Block has paid to promote the #DIYwithBlock hashtag 🙄 so this is your friendly reminder that these craven corporate ghouls are tricking you into paying for things you're entitled to for free if you earn less than $73K.

@turbotax @HRBlock @ezTaxReturn 

A thread! 1/?",11,2,2022
https://twitter.com/FarteenHu/status/1492133345500844032,2022-02-11 13:48:06+00:00,1492133345500844032,I did the #DIYwithBlock thing and then did my taxes with @turbotax.  Turbotax saved me $2000 in tax.  Then the Emerald card bled out what money was left on it in monthly charges.  So done with the Block.,1,2,7,FarteenHu,Hu Farteen,178,269,I did the #DIYwithBlock thing and then did my taxes with @turbotax.  Turbotax saved me $2000 in tax.  Then the Emerald card bled out what money was left on it in monthly charges.  So done with the Block.,11,2,2022
https://twitter.com/Q5fOqvhayTQHxwC/status/1492130622701252613,2022-02-11 13:37:17+00:00,1492130622701252613,More people could file free with H&amp;R Block Free Online than TurboTax Free Edition. #DIYwithBlock #DIYwithBlock https://t.co/U91j6TCzyj,3,3,14,Q5fOqvhayTQHxwC,快三计划/飞艇计划/彩票计划/棋牌外挂/抢庄牛牛/炸金花/PG电子/MG电子/欧宝娱乐/百家乐/棋牌,0,0,More people could file free with H&amp;R Block Free Online than TurboTax Free Edition. #DIYwithBlock #DIYwithBlock https://t.co/U91j6TCzyj,11,2,2022
https://twitter.com/nycphonebuyer/status/1492121260867870725,2022-02-11 13:00:05+00:00,1492121260867870725,"The first time I did my taxes MYSELF for my business, It said I owed $50K. I immediately went to an accountant that specialized in my industry.  Moral of the story, turbotax ain't It.",1,3,17,nycphonebuyer,Feldon Richards,14076,367,"The first time I did my taxes MYSELF for my business, It said I owed $50K. I immediately went to an accountant that specialized in my industry.

Moral of the story, turbotax ain't It.",11,2,2022
https://twitter.com/WorldTrendsInfo/status/1492107846548217859,2022-02-11 12:06:47+00:00,1492107846548217859,Coinbase partners with TurboTax to let you receive tax refunds in cryptocurrency: #BigData #MachineLearning #AI #IoT cc: @mikequindazzi https://t.co/nxnGoRobQ1 https://t.co/AhWv5RbMS4,4,0,0,WorldTrendsInfo,Kim Muro,31526,13564,Coinbase partners with TurboTax to let you receive tax refunds in cryptocurrency: #BigData #MachineLearning #AI #IoT cc: @mikequindazzi engadget.com/coinbase-turbo… https://t.co/AhWv5RbMS4,11,2,2022
https://twitter.com/dewezl/status/1492026002519826457,2022-02-11 06:41:34+00:00,1492026002519826457,"@turbotax Not free. Thought my filing was processed,  payment sure was, but actual filing was not. 6 months later $1600 in fines and interest. No thanks, not going there again. Goodbye!",1,2,0,dewezl,Eric Breland,76,589,"@turbotax Not free. Thought my filing was processed,  payment sure was, but actual filing was not. 6 months later $1600 in fines and interest. No thanks, not going there again. Goodbye!",11,2,2022
https://twitter.com/D36imunhealthy/status/1491988859881545729,2022-02-11 04:13:58+00:00,1491988859881545729,"Are all your apes gone? We here at @turbotax won’t laugh, we promise. https://t.co/fj93fFOSXQ",1,0,6,D36imunhealthy,Antifa HQ Mail Room Associate,728,480,"Are all your apes gone? We here at @turbotax won’t laugh, we promise. https://t.co/fj93fFOSXQ",11,2,2022
https://twitter.com/badboysammyx/status/1491984352842076198,2022-02-11 03:56:04+00:00,1491984352842076198,I need someone to help me run my taxes because TurboTax wan dey whine me,2,3,17,badboysammyx,BBS 🍇,14813,7019,I need someone to help me run my taxes because TurboTax wan dey whine me,11,2,2022
