url,Datetime,Tweet Id,Text,Retweet Count,Reply Count,Like Count,Username,Display Name,Followers Count,Friends Count,Rendered Content,Day,Month,Year
https://twitter.com/michellejourdan/status/562041875973308417,2015-02-02 00:16:40+00:00,562041875973308417,Avocados from Mexico just won my night. The hopeful polar bear was everything hilarious to me in that moment #SuperBowlXLIX,1,0,0,michellejourdan,maybe: Michelle,580,524,Avocados from Mexico just won my night. The hopeful polar bear was everything hilarious to me in that moment #SuperBowlXLIX,2,2,2015
https://twitter.com/benlester93/status/562041871359565824,2015-02-02 00:16:39+00:00,562041871359565824,Anyone who works at Kroger knows about those Avocados from Mexico lol,1,0,2,benlester93,Ben Lester,383,332,Anyone who works at Kroger knows about those Avocados from Mexico lol,2,2,2015
https://twitter.com/kellyswanson1/status/562041857564487683,2015-02-02 00:16:35+00:00,562041857564487683,"""Avocados from Mexico"" need to sell lots of them to pay for that ad! Must have been whole budget. #Risky #SuperBowlAds",1,2,1,kellyswanson1,Kelly Swanson,8386,2208,"""Avocados from Mexico"" need to sell lots of them to pay for that ad! Must have been whole budget. #Risky #SuperBowlAds",2,2,2015
https://twitter.com/AllisonRMyers/status/562041845950480384,2015-02-02 00:16:32+00:00,562041845950480384,First belly laugh. Thanks at Avocados from Mexico. #LouAdBowl #SuperBowlXLIX,2,0,0,AllisonRMyers,Allison Myers,1925,866,First belly laugh. Thanks at Avocados from Mexico. #LouAdBowl #SuperBowlXLIX,2,2,2015
https://twitter.com/peteratthepark/status/562041844427538432,2015-02-02 00:16:32+00:00,562041844427538432,"I love how they say ""Avocados from Mexico""🍹#AvocadosUnite #GUnit",1,0,8,peteratthepark,Bussy Philipps,587,966,"I love how they say ""Avocados from Mexico""🍹#AvocadosUnite #GUnit",2,2,2015
https://twitter.com/anoorani/status/562041835875741697,2015-02-02 00:16:30+00:00,562041835875741697,Somewhere Steve King is stunned #avocados are from #Mexico. He thought they only produced cantaloupes.,4,0,5,anoorani,Ali Noorani,10758,345,Somewhere Steve King is stunned #avocados are from #Mexico. He thought they only produced cantaloupes.,2,2,2015
https://twitter.com/LeeuhmsWorld/status/562041830988992512,2015-02-02 00:16:29+00:00,562041830988992512,Wtf was with that avocados from Mexico commercial Marcos found that offensive @marcos_d34,2,1,4,LeeuhmsWorld,LEEUHM,255,212,Wtf was with that avocados from Mexico commercial Marcos found that offensive @marcos_d34,2,2,2015
https://twitter.com/TheDannyParra/status/562041820847165441,2015-02-02 00:16:26+00:00,562041820847165441,The polar bear from the Avocados from Mexico commercial is every single Miami football fan ever,6,0,4,TheDannyParra,Danny Parra,457,1045,The polar bear from the Avocados from Mexico commercial is every single Miami football fan ever,2,2,2015
https://twitter.com/ThePunchBowl/status/562041805563527169,2015-02-02 00:16:23+00:00,562041805563527169,But what happens if you pour your Coke on your Avocados from Mexico?,1,0,2,ThePunchBowl,The Pennsylvania Punch Bowl,394,254,But what happens if you pour your Coke on your Avocados from Mexico?,2,2,2015
https://twitter.com/mwmarketingguy/status/562041804179382274,2015-02-02 00:16:23+00:00,562041804179382274,@CocaColaCo with a powerful and important message!  Have a Coke and Smile and an avocado from Mexico as well! #TrilixSuperSpots,1,0,1,mwmarketingguy,Dallas Martz,98,212,@CocaColaCo with a powerful and important message!  Have a Coke and Smile and an avocado from Mexico as well! #TrilixSuperSpots,2,2,2015
https://twitter.com/lemonpepperkev/status/562041799766978560,2015-02-02 00:16:21+00:00,562041799766978560,Republicans will soon want avocados from Mexico deported.,3,2,1,lemonpepperkev,Këv,2866,1846,Republicans will soon want avocados from Mexico deported.,2,2,2015
https://twitter.com/ashleemarketing/status/562041790241710081,2015-02-02 00:16:19+00:00,562041790241710081,Avocados from Mexico is my new favorite thing ever. #SB49 #LouAdBowl,1,0,0,ashleemarketing,Ashley Lee,451,688,Avocados from Mexico is my new favorite thing ever. #SB49 #LouAdBowl,2,2,2015
https://twitter.com/joesonheim/status/562041782884528130,2015-02-02 00:16:17+00:00,562041782884528130,"Avocados from Mexico has been saving up for 5 years for that commercial. And damn it, that was worth the money. #SuperBowl",1,0,2,joesonheim,J.O.E.,773,929,"Avocados from Mexico has been saving up for 5 years for that commercial. And damn it, that was worth the money. #SuperBowl",2,2,2015
https://twitter.com/tront/status/562041755692847104,2015-02-02 00:16:11+00:00,562041755692847104,do yall think the polar bear with the sombrero from the avocados from mexico commercial knows the zoloft polar bear from coke commercial,3,0,6,tront,tront,1449,1773,do yall think the polar bear with the sombrero from the avocados from mexico commercial knows the zoloft polar bear from coke commercial,2,2,2015
https://twitter.com/barrycunningham/status/562041750097637377,2015-02-02 00:16:10+00:00,562041750097637377,Avocados from Mexico for the win!!! Awesome!! http://t.co/3DOF1Fpfv7 #superbowl #SBcommercials,3,0,2,barrycunningham,Barry Cunningham,20436,16601,Avocados from Mexico for the win!!! Awesome!! youtu.be/ih_iLjenftw#su… #superbowl #SBcommercials,2,2,2015
https://twitter.com/SommerTime15/status/562041735174717440,2015-02-02 00:16:06+00:00,562041735174717440,That commercial was for avocados from Mexico............ #AvacadosfromMexico,1,0,10,SommerTime15,Ben Sommer,393,455,That commercial was for avocados from Mexico............ #AvacadosfromMexico,2,2,2015
https://twitter.com/ScottWilliams/status/562041728300228608,2015-02-02 00:16:04+00:00,562041728300228608,I want an Avocado from Mexico and a Coke because of the Polar Bear. #SuperBowl,2,0,4,ScottWilliams,Scott Williams,96204,60969,I want an Avocado from Mexico and a Coke because of the Polar Bear. #SuperBowl,2,2,2015
https://twitter.com/AlexisAnselmo_/status/562041721270190080,2015-02-02 00:16:03+00:00,562041721270190080,My mom would call me about the avocados from Mexico ✋😂😂,1,0,1,AlexisAnselmo_,Alexis Anselmo ✨,435,426,My mom would call me about the avocados from Mexico ✋😂😂,2,2,2015
https://twitter.com/Stoned808/status/562041716115402753,2015-02-02 00:16:02+00:00,562041716115402753,Shout out to the Avocado's from Mexico,3,0,8,Stoned808,Jacuzzi Jarret,304,256,Shout out to the Avocado's from Mexico,2,2,2015
https://twitter.com/Bobby_603/status/562041716019314688,2015-02-02 00:16:01+00:00,562041716019314688,The polar bear with the sombrero made me chuckle. Good job Avocado from Mexico.,1,0,2,Bobby_603,Bobby Moore,953,283,The polar bear with the sombrero made me chuckle. Good job Avocado from Mexico.,2,2,2015
https://twitter.com/YoungS0L0/status/562041712470536192,2015-02-02 00:16:01+00:00,562041712470536192,Avocados from Mexico is currently winning the commercial contest.,2,0,7,YoungS0L0,Nathan Ryan,396,743,Avocados from Mexico is currently winning the commercial contest.,2,2,2015
https://twitter.com/DaltonSpeers30/status/562041702676824064,2015-02-02 00:15:58+00:00,562041702676824064,Lol. That avocados from Mexico commercial was pretty good #firstdraftever,1,0,4,DaltonSpeers30,Dalton Speers,627,442,Lol. That avocados from Mexico commercial was pretty good #firstdraftever,2,2,2015
https://twitter.com/Adweek/status/562041702215856129,2015-02-02 00:15:58+00:00,562041702215856129,AVOCADOS FROM MEXICO - Even funnier than Colbert's work for pistachios. Go niche food ads! #SB49 http://t.co/7R0BzZfvNG,220,14,229,Adweek,Adweek,688971,26488,AVOCADOS FROM MEXICO - Even funnier than Colbert's work for pistachios. Go niche food ads! #SB49 http://t.co/7R0BzZfvNG,2,2,2015
https://twitter.com/AndreGoLow/status/562041690731474944,2015-02-02 00:15:55+00:00,562041690731474944,"Avocados from Mexico, stealing the jobs of hardworking American avocados. #SuperBowlCommercials",1,0,3,AndreGoLow,Andre Golo,630,311,"Avocados from Mexico, stealing the jobs of hardworking American avocados.
#SuperBowlCommercials",2,2,2015
https://twitter.com/willus__/status/562041686831144960,2015-02-02 00:15:55+00:00,562041686831144960,You my avocado from Mexico,3,0,5,willus__,fil💫,365,527,You my avocado from Mexico,2,2,2015
https://twitter.com/etothepiiplus43/status/562041674646290432,2015-02-02 00:15:52+00:00,562041674646290432,"""First Draft Ever"" commercial is the winner. Competition's over folks. Congratulations, Avocados from Mexico.",1,0,2,etothepiiplus43,Michael J. Steele,111,123,"""First Draft Ever"" commercial is the winner. Competition's over folks. Congratulations, Avocados from Mexico.",2,2,2015
https://twitter.com/KafkaRotica/status/562041670427217921,2015-02-02 00:15:51+00:00,562041670427217921,I'm going to spend the rest of the #superbowl singing the jingle: 'Avocados from Mexico',1,0,1,KafkaRotica,KafkaRotica,2791,2840,I'm going to spend the rest of the #superbowl singing the jingle: 'Avocados from Mexico',2,2,2015
https://twitter.com/kellyokeefe/status/562041652442046464,2015-02-02 00:15:46+00:00,562041652442046464,"Avocados from Mexico. Please, don't run that ad again. Take it from a friend.  #whartonfoa #vcu_brandcenter",1,0,2,kellyokeefe,Kelly O'Keefe,4708,2608,"Avocados from Mexico. Please, don't run that ad again. Take it from a friend.  #whartonfoa #vcu_brandcenter",2,2,2015
https://twitter.com/KirkCousins8/status/562041638726680577,2015-02-02 00:15:43+00:00,562041638726680577,"Avocados from Mexico ""First Draft Ever"" has been my fav commercial so far",81,19,268,KirkCousins8,Kirk Cousins,305976,353,"Avocados from Mexico ""First Draft Ever"" has been my fav commercial so far",2,2,2015
https://twitter.com/CubsNoHitStreak/status/562041634347438080,2015-02-02 00:15:42+00:00,562041634347438080,"I'm up for ""Avocados from Mexico"" replacing ""Go Cubs Go"" as the post-win celebration song.",5,2,15,CubsNoHitStreak,Cubs No-Hit Streak,10110,1633,"I'm up for ""Avocados from Mexico"" replacing ""Go Cubs Go"" as the post-win celebration song.",2,2,2015
https://twitter.com/chasemoloney_/status/562041634226196480,2015-02-02 00:15:42+00:00,562041634226196480,Avocados from Mexico had me dying 😂,2,0,12,chasemoloney_,Chase Moloney,449,330,Avocados from Mexico had me dying 😂,2,2,2015
https://twitter.com/InTheLittleWood/status/562041632741416960,2015-02-02 00:15:42+00:00,562041632741416960,"""Avocados from Mexico!"" my favourite part of the Superbowl so far haha",7,11,78,InTheLittleWood,Martyn Littlewood,245469,1172,"""Avocados from Mexico!"" my favourite part of the Superbowl so far haha",2,2,2015
https://twitter.com/popewallace/status/562041632548085760,2015-02-02 00:15:42+00:00,562041632548085760,IM ONLY BUYING AVOCADOS FROM MEXICO NOW,3,0,4,popewallace,Colin Wallace,376,539,IM ONLY BUYING AVOCADOS FROM MEXICO NOW,2,2,2015
https://twitter.com/Eber_Cortez/status/562041617876787202,2015-02-02 00:15:38+00:00,562041617876787202,Avocados from Mexico all day evryday !,1,0,1,Eber_Cortez,.,1508,632,Avocados from Mexico all day evryday !,2,2,2015
https://twitter.com/samanthapfaff9/status/562041613883432962,2015-02-02 00:15:37+00:00,562041613883432962,jk Avocados from Mexico is my fave,1,0,3,samanthapfaff9,Samantha,894,551,jk Avocados from Mexico is my fave,2,2,2015
https://twitter.com/KyleKiper/status/562041611610521600,2015-02-02 00:15:37+00:00,562041611610521600,"Great, now I'll be saying ""Avocados from Mexico"" for a week.",1,0,1,KyleKiper,Kyle Ryan Kiper,1633,2559,"Great, now I'll be saying ""Avocados from Mexico"" for a week.",2,2,2015
https://twitter.com/abby_williamsss/status/562041607252623361,2015-02-02 00:15:36+00:00,562041607252623361,"the best commercial jingle vote goes to ""avocados from mexico""🎶",1,0,1,abby_williamsss,Abby,304,301,"the best commercial jingle vote goes to ""avocados from mexico""🎶",2,2,2015
https://twitter.com/Kanew/status/562041599228534785,2015-02-02 00:15:34+00:00,562041599228534785,Domination by the Pats and Avocados from Mexico,1,0,2,Kanew,Justin Kanew,35793,4951,Domination by the Pats and Avocados from Mexico,2,2,2015
https://twitter.com/RyneNotRyanDuh/status/562041592198860800,2015-02-02 00:15:32+00:00,562041592198860800,"I just want an entire ""Avocados from Mexico"" song. That jingle has some serious potential.",1,0,1,RyneNotRyanDuh,MoonTaxiSpiritGuide,354,320,"I just want an entire ""Avocados from Mexico"" song. That jingle has some serious potential.",2,2,2015
https://twitter.com/Johnubacon/status/562041589158006784,2015-02-02 00:15:31+00:00,562041589158006784,"A surprise entrance from Avocados from Mexico. Didn't even know they were a thing. Now, they are Official -and already better &gt; Kardashian.",9,4,23,Johnubacon,John U. Bacon,53291,1152,"A surprise entrance from Avocados from Mexico. Didn't even know they were a thing. Now, they are Official -and already better &gt; Kardashian.",2,2,2015
https://twitter.com/WhitneyBlake_/status/562041584850845697,2015-02-02 00:15:30+00:00,562041584850845697,I need an avocado from Mexico now.,1,0,5,WhitneyBlake_,Whitney Hawkins,2248,173,I need an avocado from Mexico now.,2,2,2015
https://twitter.com/portlandia/status/562041573131943937,2015-02-02 00:15:27+00:00,562041573131943937,"Ppl with accents just sang ""avocados from Mexico"". Offended, but not sure why. Might've been the bear costume. #FeministbookstoreSaysWhat",120,2,272,portlandia,Portlandia,127870,893,"Ppl with accents just sang ""avocados from Mexico"". Offended, but not sure why. Might've been the bear costume. #FeministbookstoreSaysWhat",2,2,2015
https://twitter.com/RealPhi11/status/562041570590203904,2015-02-02 00:15:27+00:00,562041570590203904,"Oh California Avocados, I hope you're watching your back. Avocados from Mexico are coming for your neck. #SuperBowl",1,0,0,RealPhi11,Phillip Alonzo Yerby,446,765,"Oh California Avocados, I hope you're watching your back. Avocados from Mexico are coming for your neck. #SuperBowl",2,2,2015
https://twitter.com/SaratogaGoose/status/562041570296598528,2015-02-02 00:15:27+00:00,562041570296598528,"I'm going to be singing the ""avocados from Mexico"" jingle for at least the next week. #superbowlcommercials",5,1,9,SaratogaGoose,Spa Infield Goose,5103,2381,"I'm going to be singing the ""avocados from Mexico"" jingle for at least the next week. #superbowlcommercials",2,2,2015
https://twitter.com/theothermegryan/status/562041565129228288,2015-02-02 00:15:26+00:00,562041565129228288,"""Brazil selects the sloth."" ""Off the field issues."" Best commercial yet. You go, avocados from Mexico.",1,0,0,theothermegryan,Megan Ryan,9212,885,"""Brazil selects the sloth."" ""Off the field issues."" Best commercial yet. You go, avocados from Mexico.",2,2,2015
https://twitter.com/RichieBlevins26/status/562041563379822592,2015-02-02 00:15:25+00:00,562041563379822592,So far the avocado from Mexico commercial was the best,1,0,0,RichieBlevins26,Enigmatic Paragon,166,183,So far the avocado from Mexico commercial was the best,2,2,2015
https://twitter.com/HandsOnRealty/status/562041561542701056,2015-02-02 00:15:25+00:00,562041561542701056,Avocados from Mexico have to be expensive to pay for that ad! #superbowlcommercials #SuperBowlXLIX,2,0,0,HandsOnRealty,Lonnie Hand - Real Estate Agent,908,2952,Avocados from Mexico have to be expensive to pay for that ad! #superbowlcommercials #SuperBowlXLIX,2,2,2015
https://twitter.com/GeoffTBlosat/status/562041557030031360,2015-02-02 00:15:24+00:00,562041557030031360,"Also, Avocados From Mexico... well done!! That was fantastic! #FirstDraftEver",3,0,4,GeoffTBlosat,Geoffrey Blosat,4281,3328,"Also, Avocados From Mexico... well done!! That was fantastic! #FirstDraftEver",2,2,2015
https://twitter.com/RTeach11/status/562041552693125120,2015-02-02 00:15:23+00:00,562041552693125120,I WANT AVOCADO FROM MEXICO,1,0,1,RTeach11,Ryan,535,444,I WANT AVOCADO FROM MEXICO,2,2,2015
https://twitter.com/NCPirate13/status/562041551820304385,2015-02-02 00:15:22+00:00,562041551820304385,"If ""Avocados from Mexico"" can pay 7 figures for a Super Bowl ad, surely we can fix the national deficit.",3,0,1,NCPirate13,zd,794,399,"If ""Avocados from Mexico"" can pay 7 figures for a Super Bowl ad, surely we can fix the national deficit.",2,2,2015
https://twitter.com/JJMoncus/status/562041540009541633,2015-02-02 00:15:20+00:00,562041540009541633,Avocados from Mexico are about to BLOW UP,1,0,7,JJMoncus,JJ Moncus,339,408,Avocados from Mexico are about to BLOW UP,2,2,2015
https://twitter.com/thelevijerome/status/562041539359019008,2015-02-02 00:15:19+00:00,562041539359019008,Avocados from Mexico with the early commercial lead. That was pretty great,1,0,0,thelevijerome,Levi Russell,108,522,Avocados from Mexico with the early commercial lead. That was pretty great,2,2,2015
https://twitter.com/elijahhughes4_/status/562041538306641920,2015-02-02 00:15:19+00:00,562041538306641920,We not about to act like that avocado from Mexico commercial wasn't odee funny,1,1,4,elijahhughes4_,Eli,10862,659,We not about to act like that avocado from Mexico commercial wasn't odee funny,2,2,2015
https://twitter.com/mike_e_kaye/status/562041537031184384,2015-02-02 00:15:19+00:00,562041537031184384,"Well played, Avocados from Mexico.",2,0,1,mike_e_kaye,Mike Kaye,25993,1132,"Well played, Avocados from Mexico.",2,2,2015
https://twitter.com/JoshSchaefer25/status/562041531666669568,2015-02-02 00:15:18+00:00,562041531666669568,Scratch that... Avocados from Mexico was pretty solid,1,1,2,JoshSchaefer25,Josh Schaefer,1952,963,Scratch that... Avocados from Mexico was pretty solid,2,2,2015
https://twitter.com/AUUndercover/status/562041523085537283,2015-02-02 00:15:15+00:00,562041523085537283,Avocados from Mexico the early Super Bowl commercial winner.,9,2,18,AUUndercover,Auburn Undercover 🐅🔎,30925,2269,Avocados from Mexico the early Super Bowl commercial winner.,2,2,2015
https://twitter.com/actuallyindia/status/562041519943995392,2015-02-02 00:15:15+00:00,562041519943995392,"""""Avocados from Mexico"" I just want that to be my ringtone""-Brandon Kane",1,0,2,actuallyindia,crow type energy,452,227,"""""Avocados from Mexico"" I just want that to be my ringtone""-Brandon Kane",2,2,2015
https://twitter.com/joshsatin/status/562041508304412673,2015-02-02 00:15:12+00:00,562041508304412673,Avocados from Mexico definitely with the best commercial so far. #dodobird,4,1,33,joshsatin,Josh Satin,10835,173,Avocados from Mexico definitely with the best commercial so far. #dodobird,2,2,2015
https://twitter.com/jonathan_koziol/status/562041508233478146,2015-02-02 00:15:12+00:00,562041508233478146,Ok Avocados From Mexico...you win. Although the polar bear was clearly disappointed.,1,0,2,jonathan_koziol,Jonathan Koziol,2349,1324,Ok Avocados From Mexico...you win. Although the polar bear was clearly disappointed.,2,2,2015
https://twitter.com/TheRaceDraft/status/562041506953826305,2015-02-02 00:15:12+00:00,562041506953826305,Avocados from Mexico just have a racial draft? lmaoooo,261,4,645,TheRaceDraft,Racial Draft,139358,94,Avocados from Mexico just have a racial draft? lmaoooo,2,2,2015
https://twitter.com/ellhonnn/status/562041504185974784,2015-02-02 00:15:11+00:00,562041504185974784,I would like an avocado from Mexico,1,0,2,ellhonnn,Ellen Elizabeth,150,173,I would like an avocado from Mexico,2,2,2015
https://twitter.com/evanmohl/status/562041502516252673,2015-02-02 00:15:11+00:00,562041502516252673,Did Avocados from Mexico just win the commercial war?,4,1,4,evanmohl,Emohl,943,257,Did Avocados from Mexico just win the commercial war?,2,2,2015
https://twitter.com/billburton/status/562041500062580736,2015-02-02 00:15:10+00:00,562041500062580736,Put me on the record as opposed to avocados from Mexico. #buycalifornia,1,2,13,billburton,Bill Burton,39516,4614,Put me on the record as opposed to avocados from Mexico. #buycalifornia,2,2,2015
https://twitter.com/TommyHarnage/status/562041499504766976,2015-02-02 00:15:10+00:00,562041499504766976,That avocados from Mexico commercial was great 😂😂,2,0,2,TommyHarnage,Tommy,123,167,That avocados from Mexico commercial was great 😂😂,2,2,2015
https://twitter.com/NickPoelwijk/status/562041497604718592,2015-02-02 00:15:09+00:00,562041497604718592,"""Avocados from Mexico"" was the most messed up yet hilarious jingle I've ever heard.",1,0,3,NickPoelwijk,Nick Poelwijk,256,496,"""Avocados from Mexico"" was the most messed up yet hilarious jingle I've ever heard.",2,2,2015
https://twitter.com/MexicanMitt/status/562041490185011200,2015-02-02 00:15:08+00:00,562041490185011200,AVOCADOS FROM MEXICO SHOULD BE REQUIRED TO SHOW THEIR PAPERS #ESUPERBOWL,25,2,20,MexicanMitt,Mexican Mitt Romney,8332,1060,AVOCADOS FROM MEXICO SHOULD BE REQUIRED TO SHOW THEIR PAPERS #ESUPERBOWL,2,2,2015
https://twitter.com/castlecolors/status/562041488725401600,2015-02-02 00:15:07+00:00,562041488725401600,$4.5 MILLION FOR A FUCKING AVOCADOS FROM MEXICO COMMERCIAL WHYYYYYYY,1,0,3,castlecolors,lupe,3564,781,$4.5 MILLION FOR A FUCKING AVOCADOS FROM MEXICO COMMERCIAL WHYYYYYYY,2,2,2015
https://twitter.com/LukeRussert/status/562041488511873025,2015-02-02 00:15:07+00:00,562041488511873025,"Don't see anything topping the ""Avocados from Mexico"" jingle #SuperBowI cc @DougFlutie",15,5,51,LukeRussert,Luke Russert,266807,2944,"Don't see anything topping the ""Avocados from Mexico"" jingle #SuperBowI cc @DougFlutie",2,2,2015
https://twitter.com/T_Harter/status/562041479150182402,2015-02-02 00:15:05+00:00,562041479150182402,Avocados from Mexico out of nowhere with a great commercial😂😂,1,0,2,T_Harter,Tom Harter,341,260,Avocados from Mexico out of nowhere with a great commercial😂😂,2,2,2015
https://twitter.com/JasonFalls/status/562041476406718464,2015-02-02 00:15:04+00:00,562041476406718464,Avocados from Mexico for the win! #LouAdBowl,1,1,14,JasonFalls,Jason Falls,96678,36131,Avocados from Mexico for the win! #LouAdBowl,2,2,2015
https://twitter.com/l985/status/562041475119079424,2015-02-02 00:15:04+00:00,562041475119079424,"I want avocados, still not from Mexico, though.",4,0,8,l985,p - Not 1985,1061,371,"I want avocados, still not from Mexico, though.",2,2,2015
https://twitter.com/RTinMan13/status/562041470778351616,2015-02-02 00:15:03+00:00,562041470778351616,"Honestly can’t remember the last time I laughed at a Super Bowl ad. Well done, Avocados from Mexico. #FirstDraftEver",1,0,2,RTinMan13,Robbie Tinsley,1023,959,"Honestly can’t remember the last time I laughed at a Super Bowl ad. Well done, Avocados from Mexico. #FirstDraftEver",2,2,2015
https://twitter.com/Bmarkovich57/status/562041467666178048,2015-02-02 00:15:02+00:00,562041467666178048,"Polar bear in a sombrero, Mikey.... “@fsmikey: Avocados from Mexico, you guys….they had a SLOTH. I’ll take that.”",1,0,6,Bmarkovich57,Brian Markovich,729,625,"Polar bear in a sombrero, Mikey.... “@fsmikey: Avocados from Mexico, you guys….they had a SLOTH. I’ll take that.”",2,2,2015
https://twitter.com/BrianTijan/status/562041466638565376,2015-02-02 00:15:02+00:00,562041466638565376,Lol avocados from Mexico is the best commercial,1,0,12,BrianTijan,Brian Tijan,343,353,Lol avocados from Mexico is the best commercial,2,2,2015
https://twitter.com/DiazAngel__/status/562041465501528064,2015-02-02 00:15:02+00:00,562041465501528064,"That should be my ringtone ""Avocados from Mexico!"" Lol",1,0,1,DiazAngel__,Angel Diaz,607,437,"That should be my ringtone ""Avocados from Mexico!"" Lol",2,2,2015
https://twitter.com/dalton_clark8/status/562041464763744257,2015-02-02 00:15:02+00:00,562041464763744257,I want an Avocado from Mexico,1,0,4,dalton_clark8,Dalton Clark,512,339,I want an Avocado from Mexico,2,2,2015
https://twitter.com/theFlama/status/562041459449536512,2015-02-02 00:15:00+00:00,562041459449536512,We already know all things from #Mexico are the best including avocados! #MiGente #SuperBowl #SB49,2,0,4,theFlama,Flama,15872,2990,We already know all things from #Mexico are the best including avocados! #MiGente #SuperBowl #SB49,2,2,2015
https://twitter.com/margosports/status/562041456668737536,2015-02-02 00:15:00+00:00,562041456668737536,AVOCADOS FROM MEXICO MARKETING DIRECTOR BOUT TO GET PAID,1,2,2,margosports,Dorito Dink,1086,834,AVOCADOS FROM MEXICO MARKETING DIRECTOR BOUT TO GET PAID,2,2,2015
https://twitter.com/neongoldrecords/status/562041451044159491,2015-02-02 00:14:58+00:00,562041451044159491,wowww avocados from mexico underdog story of the year,17,1,79,neongoldrecords,Neon Gold Records,27092,910,wowww avocados from mexico underdog story of the year,2,2,2015
https://twitter.com/MadisonSocial/status/562041450121424896,2015-02-02 00:14:58+00:00,562041450121424896,Avocados from Mexico win the super bowl,9,1,16,MadisonSocial,Madison Social,17024,5858,Avocados from Mexico win the super bowl,2,2,2015
https://twitter.com/LANDOR_FITCH/status/562041445939675136,2015-02-02 00:14:57+00:00,562041445939675136,Avocados from Mexico spot misses the mark. Next time: more product benefits #brandbowl #adbowl,3,0,3,LANDOR_FITCH,Landor & Fitch,41225,5970,Avocados from Mexico spot misses the mark. Next time: more product benefits #brandbowl #adbowl,2,2,2015
https://twitter.com/angaelos_hanna/status/562041441396854784,2015-02-02 00:14:56+00:00,562041441396854784,I want some avocados from Mexico!,1,0,2,angaelos_hanna,angaelos,656,504,I want some avocados from Mexico!,2,2,2015
https://twitter.com/BillEnright/status/562041440575176704,2015-02-02 00:14:56+00:00,562041440575176704,1st great commercial from Super Bowl XLVI. Avocado from Mexico.,2,1,1,BillEnright,Bill Enright,9182,1588,1st great commercial from Super Bowl XLVI. Avocado from Mexico.,2,2,2015
https://twitter.com/DJ_RTC/status/562041437508743168,2015-02-02 00:14:55+00:00,562041437508743168,Avocados from Mexico w/the best ad early on.,1,0,3,DJ_RTC,Alexander Fruchter,6403,1828,Avocados from Mexico w/the best ad early on.,2,2,2015
