url,Datetime,Tweet Id,Text,Retweet Count,Reply Count,Like Count,Username,Display Name,Followers Count,Friends Count,Rendered Content,Day,Month,Year
https://twitter.com/GSparks40/status/562041436494110722,2015-02-02 00:14:55+00:00,562041436494110722,And out of nowhere Avocados from Mexico take the lead in Super Bowl's best commercial.,14,0,31,GSparks40,Garret Sparks,31857,1101,And out of nowhere Avocados from Mexico take the lead in Super Bowl's best commercial.,2,2,2015
https://twitter.com/zedlaV559/status/562041435805855744,2015-02-02 00:14:55+00:00,562041435805855744,AVOCADOS FROM MEXICO MOTHER FUCKERS,1,0,1,zedlaV559,Diamond TweetCenter,1075,1462,AVOCADOS FROM MEXICO MOTHER FUCKERS,2,2,2015
https://twitter.com/DavidNelson86/status/562041428671332352,2015-02-02 00:14:53+00:00,562041428671332352,First draft ever- avocado from Mexico... Brilliant,8,1,39,DavidNelson86,David Nelson,74835,2298,First draft ever- avocado from Mexico... Brilliant,2,2,2015
https://twitter.com/YnotLouis/status/562041427878633472,2015-02-02 00:14:53+00:00,562041427878633472,The avocados from Mexico is the best commercial so far 😂,1,0,1,YnotLouis,Luis,539,431,The avocados from Mexico is the best commercial so far 😂,2,2,2015
https://twitter.com/boyfriendnat/status/562041427266256896,2015-02-02 00:14:53+00:00,562041427266256896,"That Avocados from Mexico commercial was cute, though, whaddnit?",1,0,0,boyfriendnat,☽ ɴ ᴀ ᴛ  ☾,841,371,"That Avocados from Mexico commercial was cute, though, whaddnit?",2,2,2015
https://twitter.com/CaitlinnnMaryy/status/562041425496645632,2015-02-02 00:14:52+00:00,562041425496645632,Avocados from Mexico = best commercial yet. #FirstDraftEver sorry polar bear!,1,0,2,CaitlinnnMaryy,Caitlin Mary,769,989,Avocados from Mexico = best commercial yet. #FirstDraftEver sorry polar bear!,2,2,2015
https://twitter.com/Dumbass_Chuy/status/562041425026498560,2015-02-02 00:14:52+00:00,562041425026498560,Avocados from Mexico ? Should've been polar bears smh,1,0,0,Dumbass_Chuy,TrapHouseChuy,884,606,Avocados from Mexico ? Should've been polar bears smh,2,2,2015
https://twitter.com/cristoballin30/status/562041423034585091,2015-02-02 00:14:52+00:00,562041423034585091,Avocados from Mexico is like the Hassan Whiteside of Super Bowl commercials. Came out of nowhere w a triple double,4,0,3,cristoballin30,C,265,207,Avocados from Mexico is like the Hassan Whiteside of Super Bowl commercials. Came out of nowhere w a triple double,2,2,2015
https://twitter.com/b_boogey_xl/status/562041421457543168,2015-02-02 00:14:51+00:00,562041421457543168,Where'd Mexico get all this money to advertise avocados from!? #SB49,3,0,2,b_boogey_xl,burton lewis jr.,641,529,Where'd Mexico get all this money to advertise avocados from!? #SB49,2,2,2015
https://twitter.com/JGawdebt/status/562041418349572096,2015-02-02 00:14:51+00:00,562041418349572096,Avocados from Mexico spent their entire budget on that commercial,1,0,5,JGawdebt,TB12,272,362,Avocados from Mexico spent their entire budget on that commercial,2,2,2015
https://twitter.com/mightaymexican/status/562041415283134465,2015-02-02 00:14:50+00:00,562041415283134465,really want some avocados from Mexico now,1,0,2,mightaymexican,debs,581,367,really want some avocados from Mexico now,2,2,2015
https://twitter.com/legendaryPun/status/562041414901432320,2015-02-02 00:14:50+00:00,562041414901432320,Avocados from Mexico just topped all commercials thus far lol,1,0,0,legendaryPun,Punzél,694,314,Avocados from Mexico just topped all commercials thus far lol,2,2,2015
https://twitter.com/emesola/status/562041411722563585,2015-02-02 00:14:49+00:00,562041411722563585,Avocados from Mexico commercial...lmfao,1,0,2,emesola,Erika,15170,979,Avocados from Mexico commercial...lmfao,2,2,2015
https://twitter.com/NickHaddad/status/562041409675751424,2015-02-02 00:14:48+00:00,562041409675751424,It's about time that those avocados from Mexico had their voices heard,3,0,2,NickHaddad,ope sorry,449,575,It's about time that those avocados from Mexico had their voices heard,2,2,2015
https://twitter.com/sweetsoul76/status/562041408631357440,2015-02-02 00:14:48+00:00,562041408631357440,Avocados from Mexico paid for that commercial with cartel money.,2,1,0,sweetsoul76,Sweet Summer Child,1265,1280,Avocados from Mexico paid for that commercial with cartel money.,2,2,2015
https://twitter.com/natimboden/status/562041405736898561,2015-02-02 00:14:48+00:00,562041405736898561,I love the avocados from Mexico commercial,1,0,3,natimboden,natalie,713,456,I love the avocados from Mexico commercial,2,2,2015
https://twitter.com/thatskerry/status/562041404730253313,2015-02-02 00:14:47+00:00,562041404730253313,How in the hell did avocados from Mexico afford a commercial,1,0,6,thatskerry,55 And He Aint Offisides,510,504,How in the hell did avocados from Mexico afford a commercial,2,2,2015
https://twitter.com/theMANeser/status/562041401433931777,2015-02-02 00:14:46+00:00,562041401433931777,Avocados from Mexico with the best commercial so far,1,0,1,theMANeser,Mike Aneser,101,51,Avocados from Mexico with the best commercial so far,2,2,2015
https://twitter.com/ICanBeYourHerro/status/562041400431476737,2015-02-02 00:14:46+00:00,562041400431476737,Avocados from Mexico the real MVP,2,0,1,ICanBeYourHerro,Christian Hernandez,7939,2785,Avocados from Mexico the real MVP,2,2,2015
https://twitter.com/SteveStaeger/status/562041399051558912,2015-02-02 00:14:46+00:00,562041399051558912,Avocados from Mexico wins for me so far. That polar bear -- awesome. #9admeter,1,0,2,SteveStaeger,Steve Staeger,23109,4219,Avocados from Mexico wins for me so far. That polar bear -- awesome. #9admeter,2,2,2015
https://twitter.com/Ayee_pedritoo/status/562041396568145920,2015-02-02 00:14:45+00:00,562041396568145920,Lol! The avocados from Mexico commercial 🌚funny,1,0,1,Ayee_pedritoo,Pedro😐,366,309,Lol! The avocados from Mexico commercial 🌚funny,2,2,2015
https://twitter.com/LovelyyKaren/status/562041392567164928,2015-02-02 00:14:44+00:00,562041392567164928,Avocados from Mexico the heck? Lol,1,0,0,LovelyyKaren,кαяєи,1179,964,Avocados from Mexico the heck? Lol,2,2,2015
https://twitter.com/headgeek666/status/562041392482889728,2015-02-02 00:14:44+00:00,562041392482889728,"The Jingle for ""AVOCADOS FROM MEXICO"" makes me giggle incessantly",7,0,4,headgeek666,Harry Knowles,50288,7910,"The Jingle for ""AVOCADOS FROM MEXICO"" makes me giggle incessantly",2,2,2015
https://twitter.com/Queso_Henri/status/562041389526290432,2015-02-02 00:14:44+00:00,562041389526290432,Lmao that Avocados from Mexico commercial was great.,2,0,2,Queso_Henri,Henri Andre,249,354,Lmao that Avocados from Mexico commercial was great.,2,2,2015
https://twitter.com/sarahegarty/status/562041387198472193,2015-02-02 00:14:43+00:00,562041387198472193,"I don't know what that commercial was, but I kinda want avocados from Mexico now",1,2,3,sarahegarty,Sara Hegarty,3743,884,"I don't know what that commercial was, but I kinda want avocados from Mexico now",2,2,2015
https://twitter.com/Doctor_V/status/562041386623836160,2015-02-02 00:14:43+00:00,562041386623836160,You can't make avocado's from Mexico trendy #superbowl,2,0,0,Doctor_V,Bryan Vartabedian,32487,1233,You can't make avocado's from Mexico trendy #superbowl,2,2,2015
https://twitter.com/JMav9797/status/562041384513703937,2015-02-02 00:14:42+00:00,562041384513703937,Avocados from Mexico has the best commercial so far,1,0,1,JMav9797,Jay Mavani,222,832,Avocados from Mexico has the best commercial so far,2,2,2015
https://twitter.com/SuchynaMatt/status/562041383763316738,2015-02-02 00:14:42+00:00,562041383763316738,Avocados from Mexico is the best commercial ever,2,0,0,SuchynaMatt,Matt Suchyna,187,200,Avocados from Mexico is the best commercial ever,2,2,2015
https://twitter.com/stefanmymind/status/562041380873445376,2015-02-02 00:14:42+00:00,562041380873445376,It's Avocados from Mexico's game to lose!!,5,1,6,stefanmymind,Stefan Marolachakis,1869,527,It's Avocados from Mexico's game to lose!!,2,2,2015
https://twitter.com/alexiajh_/status/562041379107266560,2015-02-02 00:14:41+00:00,562041379107266560,Avocados from Mexico so childish for that.,2,0,0,alexiajh_,rocketpower,1250,843,Avocados from Mexico so childish for that.,2,2,2015
https://twitter.com/RyanSnitzer/status/562041373428162560,2015-02-02 00:14:40+00:00,562041373428162560,I now want some avocados from Mexico 😂,1,1,4,RyanSnitzer,Snitz,677,455,I now want some avocados from Mexico 😂,2,2,2015
https://twitter.com/fsmikey/status/562041371042004994,2015-02-02 00:14:39+00:00,562041371042004994,"Avocados from Mexico, you guys….they had a SLOTH. I’ll take that.",11,0,53,fsmikey,Mikey,120361,998,"Avocados from Mexico, you guys….they had a SLOTH. I’ll take that.",2,2,2015
https://twitter.com/LindsayGuentzel/status/562041364326514688,2015-02-02 00:14:38+00:00,562041364326514688,Avocados from Mexico.  I laughed out loud.,2,0,5,LindsayGuentzel,Lindsay Guentzel,8181,604,"Avocados from Mexico.

I laughed out loud.",2,2,2015
https://twitter.com/HugoUchis/status/562041349856563200,2015-02-02 00:14:34+00:00,562041349856563200,Avocados from Mexico just sounds wrong,1,0,0,HugoUchis,🛸 foxxy 🛸,543,505,Avocados from Mexico just sounds wrong,2,2,2015
https://twitter.com/DJ_ShawnG/status/562041348019453952,2015-02-02 00:14:34+00:00,562041348019453952,Shouts To The Avocados From Mexico,6,0,6,DJ_ShawnG,Shawn G,10067,1370,Shouts To The Avocados From Mexico,2,2,2015
https://twitter.com/Da_Bolivian/status/562041347402526720,2015-02-02 00:14:34+00:00,562041347402526720,Avocados from Mexico for commercial of the year,1,0,1,Da_Bolivian,Sebastian Patino,271,140,Avocados from Mexico for commercial of the year,2,2,2015
https://twitter.com/RunSoHard/status/562041341199540225,2015-02-02 00:14:32+00:00,562041341199540225,That Avocados from Mexico commercial is easily the best thus far!,1,0,0,RunSoHard,The Nate Brown,369,615,That Avocados from Mexico commercial is easily the best thus far!,2,2,2015
https://twitter.com/BMauldy/status/562041329858129920,2015-02-02 00:14:29+00:00,562041329858129920,Avocados from Mexico was the best commercial yet,1,0,1,BMauldy,B-Mauldy™,459,473,Avocados from Mexico was the best commercial yet,2,2,2015
https://twitter.com/ochoaxandres/status/562041323830513664,2015-02-02 00:14:28+00:00,562041323830513664,Avocados from Mexico hahahahahahahah I love that voice,1,0,1,ochoaxandres,Ace,563,294,Avocados from Mexico hahahahahahahah I love that voice,2,2,2015
https://twitter.com/nzmuda/status/562041314129510400,2015-02-02 00:14:26+00:00,562041314129510400,I totally love the Avocados from Mexico ad. And the jingle is pretty catchy too.,8,1,6,nzmuda,Natalie Zmuda,5653,923,I totally love the Avocados from Mexico ad. And the jingle is pretty catchy too.,2,2,2015
https://twitter.com/jonhumbert/status/562041305455681538,2015-02-02 00:14:24+00:00,562041305455681538,*Love* this Avocados from Mexico add. #FirstDraftEver. POLAR BEAR,2,0,2,jonhumbert,jonhumbert,5137,2575,*Love* this Avocados from Mexico add. #FirstDraftEver. POLAR BEAR,2,2,2015
https://twitter.com/disolis/status/562037614740377600,2015-02-01 23:59:44+00:00,562037614740377600,"@ajcorchado: MT #Mexico, one of first foreign countries to advertise in #SuperBowlSunday . #Avocados from #Michoacan @miblogestublog",1,1,6,disolis,Dianne Solis ✍🏽,9731,3141,"@ajcorchado: MT #Mexico, one of first foreign countries to advertise in #SuperBowlSunday . #Avocados from #Michoacan @miblogestublog",1,2,2015
https://twitter.com/IvonneKinser/status/562034347209801728,2015-02-01 23:46:45+00:00,562034347209801728,Avocados from Mexico Super Bowl 2015 commercial: Time-traveling back to the first draft http://t.co/R7vj1yzVGr #SuperBowlAd #SuperBowl,10,1,2,IvonneKinser,Ivonne Kinser 🇺🇦 #StandWithUkraine,11365,9641,Avocados from Mexico Super Bowl 2015 commercial: Time-traveling back to the first draft wapo.st/1z3enWB #SuperBowlAd #SuperBowl,1,2,2015
https://twitter.com/ajcorchado/status/562032416106115072,2015-02-01 23:39:04+00:00,562032416106115072,"#Mexico, one of first foreign countries to advertise in #SuperBowlSunday . #Avocados from #Michoacan @srgsilvac @AKochergaBorder",9,2,8,ajcorchado,Alfredo Corchado,15916,1731,"#Mexico, one of first foreign countries to advertise in #SuperBowlSunday . #Avocados from #Michoacan @srgsilvac @AKochergaBorder",1,2,2015
https://twitter.com/robotrepair/status/562020291979640832,2015-02-01 22:50:54+00:00,562020291979640832,watch for robot repair's 2 superbowl commercials: avocados from mexico (sound design) and lexus (music). go sports!,1,3,3,robotrepair,robot repair,302,598,watch for robot repair's 2 superbowl commercials: avocados from mexico (sound design) and lexus (music). go sports!,1,2,2015
https://twitter.com/mclanea/status/562013821636595712,2015-02-01 22:25:11+00:00,562013821636595712,Know what's better than avocados from Mexico? Avocados from San Diego. #SuperBowlXLIX,1,0,1,mclanea,Adam McLane,4042,568,Know what's better than avocados from Mexico? Avocados from San Diego. #SuperBowlXLIX,1,2,2015
https://twitter.com/ChrisH0dgkinson/status/562010937540882432,2015-02-01 22:13:43+00:00,562010937540882432,"""The Super Bowl brought to you by Avocados from Mexico"" uhh what? Haha",1,0,1,ChrisH0dgkinson,Chris H.,341,538,"""The Super Bowl brought to you by Avocados from Mexico"" uhh what? Haha",1,2,2015
https://twitter.com/jeffrossen/status/562010448196034560,2015-02-01 22:11:47+00:00,562010448196034560,"Love how ""avocados from Mexico"" are a pre-game sponsor. Heck I'm sold.",4,3,16,jeffrossen,Jeff Rossen,41849,318,"Love how ""avocados from Mexico"" are a pre-game sponsor. Heck I'm sold.",1,2,2015
https://twitter.com/ChefMartinLopez/status/562003166641016833,2015-02-01 21:42:51+00:00,562003166641016833,Like Avocados? Get ready for the small screen debut this evening during the #BigGame! Avocados From Mexico –... http://t.co/YBk4EsRwVc,1,0,5,ChefMartinLopez,Chef Martin Lopez,21606,201,"Like Avocados?
Get ready for the small screen debut this evening during the #BigGame! Avocados From Mexico –... fb.me/73nqZtIWn",1,2,2015
https://twitter.com/ChefMartinLopez/status/561999291250905090,2015-02-01 21:27:27+00:00,561999291250905090,"Now, this is a Rocking Guacamole! Thank you Paty Jinich, Paty is the AVOCADOS FROM MEXICO BRAND AMBASSADOR.... http://t.co/2IGvCH7eUy",1,1,4,ChefMartinLopez,Chef Martin Lopez,21606,201,"Now, this is a Rocking Guacamole! Thank you Paty Jinich,
Paty is the AVOCADOS FROM MEXICO BRAND AMBASSADOR.... fb.me/70wajNQeH",1,2,2015
https://twitter.com/textiff/status/561987315661545472,2015-02-01 20:39:51+00:00,561987315661545472,@MomItForward I am a fan of Avocados from Mexico because they are always of high quality &amp; available year-round! #FirstDraftEver #gno #ad,3,1,0,textiff,Sheryl,9600,10442,@MomItForward I am a fan of Avocados from Mexico because they are always of high quality &amp; available year-round! #FirstDraftEver #gno #ad,1,2,2015
https://twitter.com/BrettRelander/status/561987304496308224,2015-02-01 20:39:49+00:00,561987304496308224,Avocados From Mexico Goes All in For Super Bowl XLIX http://t.co/le0OmFKS3n #FirstDraftEver,12,0,26,BrettRelander,Brett Relander,157578,47263,Avocados From Mexico Goes All in For Super Bowl XLIX ow.ly/IiRtd #FirstDraftEver,1,2,2015
https://twitter.com/purplepassion12/status/561987041483698176,2015-02-01 20:38:46+00:00,561987041483698176,@MomItForward I can count on quality avocados from Avocados From Mexico every time I buy &amp; use them #gno #FirstDraftEver,1,0,0,purplepassion12,purplepassion12,1923,4531,@MomItForward I can count on quality avocados from Avocados From Mexico every time I buy &amp; use them #gno #FirstDraftEver,1,2,2015
https://twitter.com/MTAFashionBlog/status/561986985309786112,2015-02-01 20:38:33+00:00,561986985309786112,@MomItForward I'm a BUG fan of Avocados From Mexico because they can be enjoyed so many ways and are DELICIOUS! #FirstDraftEver #gno,2,0,0,MTAFashionBlog,MoreThanAFashionBlog,3015,1293,@MomItForward I'm a BUG fan of Avocados From Mexico because they can be enjoyed so many ways and are DELICIOUS! #FirstDraftEver #gno,1,2,2015
https://twitter.com/MomItForward/status/561986619461218304,2015-02-01 20:37:05+00:00,561986619461218304,GIVEAWAY QUESTION! Why are you a fan of Avocados From Mexico? #FirstDraftEver #gno #ad PLS RT,43,79,15,MomItForward,Mom It Forward,75618,21945,GIVEAWAY QUESTION! Why are you a fan of Avocados From Mexico? #FirstDraftEver #gno #ad PLS RT,1,2,2015
https://twitter.com/nanasdeals/status/561983924780691456,2015-02-01 20:26:23+00:00,561983924780691456,Avocados From Mexico are our Go-To for all Avocado Recipes for our family!   #FirstDraftEver  #gno #ad http://t.co/fMXthsZvr1,1,0,0,nanasdeals,Tia  - #LoveYourSoul,2970,930,Avocados From Mexico are our Go-To for all Avocado Recipes for our family!   #FirstDraftEver  #gno #ad bit.ly/1EyLAN7,1,2,2015
https://twitter.com/Midge_Munro/status/561973995587657731,2015-02-01 19:46:56+00:00,561973995587657731,#Avocados From Mexico – #FirstDraftEver #SuperBowl commercial: http://t.co/QwaLIzjV0n,2,0,1,Midge_Munro,Midge Munro,456,259,#Avocados From Mexico – #FirstDraftEver #SuperBowl commercial: youtu.be/26hl9YWLyn4,1,2,2015
https://twitter.com/DianeJinMN/status/561963166356484096,2015-02-01 19:03:54+00:00,561963166356484096,@AvosfromMexico Team Avocados from Mexico has what it takes to cover the spread. #FirstDraftEver #sweeps,1,0,1,DianeJinMN,Diane Johnson,35,177,@AvosfromMexico Team Avocados from Mexico has what it takes to cover the spread. #FirstDraftEver #sweeps,1,2,2015
https://twitter.com/mexico/status/561962323167158272,2015-02-01 19:00:33+00:00,561962323167158272,"At #SuperBowlXLIX, don't miss the ""Avocados From Mexico"" ad after 1st quarter #FirstDraftEver http://t.co/muUDlvUgbp http://t.co/v7omA1wgyy",17,0,12,mexico,México,369394,326,"At #SuperBowlXLIX, don't miss the ""Avocados From Mexico"" ad after 1st quarter #FirstDraftEver huff.to/1wJXPxp http://t.co/v7omA1wgyy",1,2,2015
https://twitter.com/LC_718/status/561961352563265536,2015-02-01 18:56:41+00:00,561961352563265536,"Welcome to the Super Bowl, brought to you by Avocados from Mexico. Betches can't even right now.",1,0,0,LC_718,LC,224,714,"Welcome to the Super Bowl, brought to you by Avocados from Mexico. Betches can't even right now.",1,2,2015
https://twitter.com/MegTucker1/status/561927006380892160,2015-02-01 16:40:13+00:00,561927006380892160,Can I get a what what! Move over an make way for the one and only Avocado from Mexico! Aye Aye Aye! @AvosfromMexico #FirstDraftEver #sweeps,1,0,1,MegTucker1,Meg Tucker,5759,3602,Can I get a what what! Move over an make way for the one and only Avocado from Mexico! Aye Aye Aye! @AvosfromMexico #FirstDraftEver #sweeps,1,2,2015
https://twitter.com/jamieharrington/status/561915876119969793,2015-02-01 15:55:59+00:00,561915876119969793,Chunky 7-Layer Dip with Avocados from Mexico--perfect Big Game treat!  @AvocadosfromMexico #gno #FirstDraftEver #ad  http://t.co/09RZlQca7j,1,0,0,jamieharrington,Jamie Harrington,10355,673,"Chunky 7-Layer Dip with Avocados from Mexico--perfect Big Game treat! 
@AvocadosfromMexico #gno #FirstDraftEver #ad 
totallythebomb.com/avocados-mexic…",1,2,2015
https://twitter.com/thriftymaven/status/561861551934537728,2015-02-01 12:20:07+00:00,561861551934537728,#FirstDraftEver http://t.co/RCZImHFN7X Avocados from Mexico the MVP of your Super Bowl party,2,0,1,thriftymaven,thriftymaven,2686,2571,#FirstDraftEver youtu.be/26hl9YWLyn4 Avocados from Mexico the MVP of your Super Bowl party,1,2,2015
https://twitter.com/thriftymaven/status/561861245297364992,2015-02-01 12:18:54+00:00,561861245297364992,#FirstDraftEver http://t.co/RCZImHFN7X Avocados from Mexico without them your Super Bowl party will be deflated,1,0,2,thriftymaven,thriftymaven,2686,2571,#FirstDraftEver youtu.be/26hl9YWLyn4 Avocados from Mexico without them your Super Bowl party will be deflated,1,2,2015
https://twitter.com/frank68871547/status/561800886876635136,2015-02-01 08:19:03+00:00,561800886876635136,@AvosfromMexico A Party without Avocados from Mexico is like The Super Bowl game without commercials. #FirstDraftEver #sweeps j,1,0,0,frank68871547,Daisy🐶,99,477,@AvosfromMexico A Party without Avocados from Mexico is like The Super Bowl game without commercials. #FirstDraftEver #sweeps j,1,2,2015
https://twitter.com/lrubiof/status/561704977043693569,2015-02-01 01:57:57+00:00,561704977043693569,Avocados From Mexico imagines the 'First Draft Ever' with its first Super Bowl ad http://t.co/K9MRb0zWqg via @usatodaysports,3,1,4,lrubiof,Luis Rubio,38352,832,Avocados From Mexico imagines the 'First Draft Ever' with its first Super Bowl ad shar.es/1oblmL via @usatodaysports,1,2,2015
