url,Datetime,Tweet Id,Text,Retweet Count,Reply Count,Like Count,Username,Display Name,Followers Count,Friends Count,Rendered Content,Day,Month,Year
https://twitter.com/mrdaveturner/status/828630136266297344,2017-02-06 15:43:14+00:00,828630136266297344,"Possible upside: Trump fans boycott Budweiser, discover nice tasting beer, become less awful.",8,5,22,mrdaveturner,Dave Turner,18581,1844,"Possible upside: Trump fans boycott Budweiser, discover nice tasting beer, become less awful.",6,2,2017
https://twitter.com/LynnWoodSpeaks/status/828630051197485056,2017-02-06 15:42:54+00:00,828630051197485056,"Um, #boycottbudwiser? Never heard of it. However, congrats to @Budweiser on a stellar ad. Same to @CocaCola and @Airbnb. Great ads!",1,1,1,LynnWoodSpeaks,Devin Nunes Disappointed Aunt,415,1150,"Um, #boycottbudwiser? Never heard of it. However, congrats to @Budweiser on a stellar ad. Same to @CocaCola and @Airbnb. Great ads!",6,2,2017
https://twitter.com/yuriboats/status/828629770871115777,2017-02-06 15:41:47+00:00,828629770871115777,if they're gonna boycott budweiser for having an immigrant founder are they gonna boycott Google too?,1,2,1,yuriboats,Nico🦝Hadrian Eveningshade,1665,741,if they're gonna boycott budweiser for having an immigrant founder are they gonna boycott Google too?,6,2,2017
https://twitter.com/Our_Tennessee/status/828629373020405760,2017-02-06 15:40:12+00:00,828629373020405760,Did you see the brief glimpse of the @Budweiser Clydesdales last night? @utcvm has taken care of them since 1982: https://t.co/PJvMY6cNQX,1,0,4,Our_Tennessee,Our Tennessee,3368,2467,Did you see the brief glimpse of the @Budweiser Clydesdales last night? @utcvm has taken care of them since 1982: ow.ly/12yL308IUZ3,6,2,2017
https://twitter.com/elfortney/status/828629315977875456,2017-02-06 15:39:58+00:00,828629315977875456,"I don't even like Budweiser but I'm about to buy a few cases. An All-American commercial, great job. #boycottbudwiser umm no.",75,3,325,elfortney,Eric,3519,544,"I don't even like Budweiser but I'm about to buy a few cases. An All-American commercial, great job. #boycottbudwiser umm no.",6,2,2017
https://twitter.com/CecebetterCCme/status/828629294431797250,2017-02-06 15:39:53+00:00,828629294431797250,"Lmaooo y'all boycotting @budweiser, which is owned by Anheuser-Busch, which owns a LOT of y'all fave beer. Lol good cuck",1,0,1,CecebetterCCme,The Arghs of March 2020,258,228,"Lmaooo y'all boycotting @budweiser, which is owned by Anheuser-Busch, which owns a LOT of y'all fave beer. Lol good cuck",6,2,2017
https://twitter.com/216LIBRA/status/828629289260167169,2017-02-06 15:39:52+00:00,828629289260167169,"I don't think Budweiser is worried about selling its products to hick town,USA. They sell in cities. #boycottbudwiser #NotMySuperBowlChamps",1,0,4,216LIBRA,LIBRA,216,14,"I don't think Budweiser is worried about selling its products to hick town,USA. They sell in cities. #boycottbudwiser #NotMySuperBowlChamps",6,2,2017
https://twitter.com/11Rainybows/status/828629254967554048,2017-02-06 15:39:44+00:00,828629254967554048,"#boycottbudweiser doesn't make sense. It's about a legal immigrant and capitalism, two things that made/make America great. 👍@Budweiser",1,1,7,11Rainybows,Bows,11595,8967,"#boycottbudweiser doesn't make sense. It's about a legal immigrant and capitalism, two things that made/make America great. 👍@Budweiser",6,2,2017
https://twitter.com/TheMikeHarris/status/828629182942953472,2017-02-06 15:39:27+00:00,828629182942953472,"There's something beautifully appropriate in that ""Budweiser"" is misspelled in the now-trending #BoycottBudwiser. https://t.co/8rQP4iiRWZ",2,0,8,TheMikeHarris,Mike Harris,1676,510,"There's something beautifully appropriate in that ""Budweiser"" is misspelled in the now-trending #BoycottBudwiser. https://t.co/8rQP4iiRWZ",6,2,2017
https://twitter.com/historynerd71/status/828629136482656259,2017-02-06 15:39:15+00:00,828629136482656259,"I may have to start buying Budweiser, as the grandson of immigrants that came here to escape oppression. Bravo Bud #boycottbudwiser",1,1,7,historynerd71,Shawn MacIntyre,26,138,"I may have to start buying Budweiser, as the grandson of immigrants that came here to escape oppression. Bravo Bud #boycottbudwiser",6,2,2017
https://twitter.com/mhildreth/status/828628975106797570,2017-02-06 15:38:37+00:00,828628975106797570,Does this mean we have to start drinking @Budweiser now? Ugh. The sacrifices we me make for progress. #MuslimBan #boycottbudwiser #SuperBowl,1,2,4,mhildreth,Matt Hildreth,9556,8626,Does this mean we have to start drinking @Budweiser now? Ugh. The sacrifices we me make for progress. #MuslimBan #boycottbudwiser #SuperBowl,6,2,2017
https://twitter.com/KatSchrodinger/status/828628935235739648,2017-02-06 15:38:27+00:00,828628935235739648,"I am from Irish ancestors and this is how America welcomed us. #MAGA snowflakes, offended by Coke and Budweiser. https://t.co/KmRbLZOTS3",4,1,6,KatSchrodinger,Kat Butler 💖💜💙,3019,3360,"I am from Irish ancestors and this is how America welcomed us. #MAGA snowflakes, offended by Coke and Budweiser. https://t.co/KmRbLZOTS3",6,2,2017
https://twitter.com/TomDangora/status/828628755807686656,2017-02-06 15:37:45+00:00,828628755807686656,"What is ""budwiser"" LOL these are not bright people! Now excuse me while I get a 6 pack of budweiser  #boycottbudwiser LOL Deplorable Fools 😆",13,3,89,TomDangora,Tom D'Angora (he/him/his) #StillWithHer,60462,52947,"What is ""budwiser"" LOL these are not bright people! Now excuse me while I get a 6 pack of budweiser  #boycottbudwiser LOL Deplorable Fools 😆",6,2,2017
https://twitter.com/SouthEndMedia/status/828628562571825152,2017-02-06 15:36:59+00:00,828628562571825152,All the #SB51Ads. #Proud of the agencies &amp; their clients taking a risk: #Airbnb #Audi #Avacados #Budweiser # Coca-Cola #84Lumber #10Haircare https://t.co/G9eanistLW,1,0,0,SouthEndMedia,SouthEndMedia,264,484,All the #SB51Ads. #Proud of the agencies &amp; their clients taking a risk: #Airbnb #Audi #Avacados #Budweiser # Coca-Cola #84Lumber #10Haircare twitter.com/adage/status/8…,6,2,2017
https://twitter.com/heartbread/status/828628463934382080,2017-02-06 15:36:35+00:00,828628463934382080,the fact that budweiser is misspelled in the trending topic to boycott them is just amazing,2,1,33,heartbread,India K,9146,430,the fact that budweiser is misspelled in the trending topic to boycott them is just amazing,6,2,2017
https://twitter.com/WeSeeYou_Trump/status/828628458188181504,2017-02-06 15:36:34+00:00,828628458188181504,Leave it 2 @realDonaldTrump supporters 2 #boycottbudwiser ... &amp; not know how 2 spell Budweiser. I'll be drinking more of it!  #TheResistance,71,7,241,WeSeeYou_Trump,Resist Often,962,368,"Leave it 2 @realDonaldTrump supporters 2 #boycottbudwiser ... &amp; not know how 2 spell Budweiser. I'll be drinking more of it!

#TheResistance",6,2,2017
https://twitter.com/justiceputnam/status/828628297340706821,2017-02-06 15:35:55+00:00,828628297340706821,Spelling Budweiser for Dummies #TitleOfMySelfHelpBook,1,0,1,justiceputnam,Radio Justice 📻🎙⚖,2625,1436,Spelling Budweiser for Dummies #TitleOfMySelfHelpBook,6,2,2017
https://twitter.com/dinoticinelli/status/828628159625052161,2017-02-06 15:35:23+00:00,828628159625052161,I suddenly feel like buying some lumber and drinking Budweiser. #84lumber #BudweiserAD #NotMyPOTUS /cc @84LumberNews @Budweiser,1,0,2,dinoticinelli,dino,237,99,I suddenly feel like buying some lumber and drinking Budweiser. #84lumber #BudweiserAD #NotMyPOTUS /cc @84LumberNews @Budweiser,6,2,2017
https://twitter.com/cushbomb/status/828627866090864641,2017-02-06 15:34:13+00:00,828627866090864641,Just took out another mortgage to buy more Budweiser and lumber. I'm just piling it up in the back yard at this point. #Resistance,40,6,306,cushbomb,matt christman,166301,1111,Just took out another mortgage to buy more Budweiser and lumber. I'm just piling it up in the back yard at this point. #Resistance,6,2,2017
https://twitter.com/SophiaTarlas/status/828627759324921856,2017-02-06 15:33:47+00:00,828627759324921856,Relieved that folks want to #boycottbudwiser and not #Budweiser-Trumps #fakereality of #fakenews  #fakewords #fakeproblems now has #fakebeer,4,0,3,SophiaTarlas,SophiaTarlas,367,2277,Relieved that folks want to #boycottbudwiser and not #Budweiser-Trumps #fakereality of #fakenews  #fakewords #fakeproblems now has #fakebeer,6,2,2017
https://twitter.com/TheMartiniDiva/status/828627624943443968,2017-02-06 15:33:15+00:00,828627624943443968,#ILikePeopleWho can spell Budweiser. https://t.co/7f2DJu9stP,1,0,3,TheMartiniDiva,TheMartiniDiva™,7842,2997,#ILikePeopleWho can spell Budweiser. https://t.co/7f2DJu9stP,6,2,2017
https://twitter.com/Siggyv/status/828627435658817538,2017-02-06 15:32:30+00:00,828627435658817538,Just took an Uber to Starbucks while drinking a Budweiser,1,1,5,Siggyv,𝕊𝕚𝕘𝕘𝕪𝔾𝕦𝕟𝕤 ❼ 🇩🇴🇪🇨,5193,1760,Just took an Uber to Starbucks while drinking a Budweiser,6,2,2017
https://twitter.com/de_stressed/status/828627381699112961,2017-02-06 15:32:17+00:00,828627381699112961,"It seems like the goal of many companies was to release a heartfelt commercial, like the Audi and Budweiser commercial #NHRHSDECA #SBDECA",1,1,1,de_stressed,Allen Park,2,3,"It seems like the goal of many companies was to release a heartfelt commercial, like the Audi and Budweiser commercial
#NHRHSDECA
#SBDECA",6,2,2017
https://twitter.com/neodymium03/status/828627321833848832,2017-02-06 15:32:03+00:00,828627321833848832,"Look, if you're boycotting Budweiser because of a shitty, historically-inaccurate commercial, then you've never tasted a Budweiser.",6,0,19,neodymium03,Neodimes,4237,3853,"Look, if you're boycotting Budweiser because of a shitty, historically-inaccurate commercial, then you've never tasted a Budweiser.",6,2,2017
https://twitter.com/TheMartiniDiva/status/828627246902501377,2017-02-06 15:31:45+00:00,828627246902501377,How can you #boycottbudwiser if you don't even know how to spell Budweiser? https://t.co/SoL84e6Xhs,6,0,10,TheMartiniDiva,TheMartiniDiva™,7842,2997,How can you #boycottbudwiser if you don't even know how to spell Budweiser? https://t.co/SoL84e6Xhs,6,2,2017
https://twitter.com/CynCyn198/status/828627218192531457,2017-02-06 15:31:38+00:00,828627218192531457,"If you want to boycott a product, know how to spell the products name. It's Budweiser. #boycottbudwiser",9,1,15,CynCyn198,Cyndi ☃️❄️ #bbcan10,446,351,"If you want to boycott a product, know how to spell the products name. It's Budweiser. #boycottbudwiser",6,2,2017
https://twitter.com/Indie88Toronto/status/828627081949016065,2017-02-06 15:31:06+00:00,828627081949016065,Just announced! @muse w/ @30SECONDSTOMARS are coming to the Budweiser Stage on 07/18! Get tix early w/ our pre-sale! https://t.co/uauTJ9OrYN https://t.co/UySWq9nmhf,3,0,7,Indie88Toronto,INDIE88,47402,875,Just announced! @muse w/ @30SECONDSTOMARS are coming to the Budweiser Stage on 07/18! Get tix early w/ our pre-sale! bit.ly/2kK97a9 https://t.co/UySWq9nmhf,6,2,2017
https://twitter.com/Lis_on_Life/status/828627060671266816,2017-02-06 15:31:01+00:00,828627060671266816,I'm guessing whoever started the #boycottbudwiser never drank Bud in the first place... or else they'd know how to spell Budweiser.,3,0,12,Lis_on_Life,Lisa T ⚖️ 🏳️‍🌈🇦🇲,449,1166,I'm guessing whoever started the #boycottbudwiser never drank Bud in the first place... or else they'd know how to spell Budweiser.,6,2,2017
https://twitter.com/MoenMikey/status/828627000373833731,2017-02-06 15:30:46+00:00,828627000373833731,"@KrauseForIowa @Budweiser Yes, I don't even drink, but I will be buying a pack of #Budweiser today! #TheResistance",3,0,5,MoenMikey,Michele Moen,4181,5241,"@KrauseForIowa @Budweiser Yes, I don't even drink, but I will be buying a pack of #Budweiser today! #TheResistance",6,2,2017
https://twitter.com/MarissaIsAllEn/status/828626922032685056,2017-02-06 15:30:28+00:00,828626922032685056,"Of course the people who are tweeting ""boycott Budweiser"" spelled it #BoycottBudwiser. They're too ignorant to even spell. #NoBanNoWall",2,0,6,MarissaIsAllEn,Marissa,228,281,"Of course the people who are tweeting ""boycott Budweiser"" spelled it #BoycottBudwiser. They're too ignorant to even spell. #NoBanNoWall",6,2,2017
https://twitter.com/BL3SS3D_B3AUTY/status/828626870623227906,2017-02-06 15:30:15+00:00,828626870623227906,Anyone going on with this boycott Coke and Budweiser because of diversity needs to delete twitter too. They also support diversity. ☕️🐸,1,0,1,BL3SS3D_B3AUTY,LO ツ,807,916,Anyone going on with this boycott Coke and Budweiser because of diversity needs to delete twitter too. They also support diversity. ☕️🐸,6,2,2017
https://twitter.com/steviefan101/status/828626685654351873,2017-02-06 15:29:31+00:00,828626685654351873,We are no longer supporting Budweiser #BoycottBudweiser,1,1,0,steviefan101,Elizabeth,2,273,We are no longer supporting Budweiser #BoycottBudweiser,6,2,2017
https://twitter.com/greguhguh/status/828626384146821126,2017-02-06 15:28:19+00:00,828626384146821126,"It's completely un-American to boycott Budweiser, especially because Mr. Busch was a hero of the Bowling Green Massacre.",1,0,1,greguhguh,Gregg Miller,163,1120,"It's completely un-American to boycott Budweiser, especially because Mr. Busch was a hero of the Bowling Green Massacre.",6,2,2017
https://twitter.com/NoVaTwitr/status/828626309521743873,2017-02-06 15:28:01+00:00,828626309521743873,So the geniuses misspelled Budweiser. They misspelled Hamilton too when they boycotted that. Can you spell duh? #boycottbudwiser,3,0,7,NoVaTwitr,Get Vaccinated Already,744,1264,So the geniuses misspelled Budweiser. They misspelled Hamilton too when they boycotted that. Can you spell duh? #boycottbudwiser,6,2,2017
https://twitter.com/margecmurph/status/828626215955206144,2017-02-06 15:27:39+00:00,828626215955206144,"Trumps supporters should've gotten the heads up on how to spell, but none the BUDWEISER HAHAHAHHA #boycottbudwiser",3,0,5,margecmurph,maggie,324,1242,"Trumps supporters should've gotten the heads up on how to spell, but none the BUDWEISER HAHAHAHHA #boycottbudwiser",6,2,2017
https://twitter.com/senna1/status/828626043242168320,2017-02-06 15:26:58+00:00,828626043242168320,I don't drink budweiser because it tastes like piss!! I could care less about a fucking commercial #boycottbudweiser,3,0,16,senna1,SENNAONE,12463,1202,I don't drink budweiser because it tastes like piss!! I could care less about a fucking commercial #boycottbudweiser,6,2,2017
https://twitter.com/sofain/status/828625939407859712,2017-02-06 15:26:33+00:00,828625939407859712,Jesus H Fuckingchrist... #boycottbudwiser is more proof that SJWs afflict both sides and very few of them can spell Budweiser correctly.,1,7,11,sofain,So Fain 🇺🇦,7708,4185,Jesus H Fuckingchrist... #boycottbudwiser is more proof that SJWs afflict both sides and very few of them can spell Budweiser correctly.,6,2,2017
https://twitter.com/whiskey_owl/status/828625876174643200,2017-02-06 15:26:18+00:00,828625876174643200,@thinkinglatina @RareGuy4Cures @Budweiser  You're more likely to get shot by a toddler than killed by a terrorist,1,2,2,whiskey_owl,Drew,70,356,"@thinkinglatina @RareGuy4Cures @Budweiser 
You're more likely to get shot by a toddler than killed by a terrorist",6,2,2017
https://twitter.com/maggiekapustka/status/828625840443383808,2017-02-06 15:26:10+00:00,828625840443383808,"People have started a hashtag ""#boycottbudwiser"" b/c of its immigration ad... but they don't even know how to spell Budweiser :/",1,0,7,maggiekapustka,Maggie Kapustka,1133,1182,"People have started a hashtag ""#boycottbudwiser"" b/c of its immigration ad... but they don't even know how to spell Budweiser :/",6,2,2017
https://twitter.com/WyldeHeartedSon/status/828625358907899904,2017-02-06 15:24:15+00:00,828625358907899904,"The people who #boycottbudwiser will still drink #BudWeiser because they'll think it's two different things, like Obamacare and the ACA.",492,15,1264,WyldeHeartedSon,☠FLOKI☠,3904,3904,"The people who #boycottbudwiser will still drink #BudWeiser because they'll think it's two different things, like Obamacare and the ACA.",6,2,2017
https://twitter.com/thereallcherico/status/828624831784558594,2017-02-06 15:22:09+00:00,828624831784558594,"Don't worry ! We all will #boycottbudwiser , the Dollar Store knock off.  We perfer @Budweiser ! Much better beer!",1,0,0,thereallcherico,(((Louise Cherico))) She/Her,677,1834,"Don't worry ! We all will #boycottbudwiser , the Dollar Store knock off.  We perfer @Budweiser ! Much better beer!",6,2,2017
https://twitter.com/DadsUpLate/status/828624594856706048,2017-02-06 15:21:13+00:00,828624594856706048,"I stopped drinking Budweiser when I was like 24 and discovered better beers. Now, I might go buy some. #BoycottStupidity",1,0,6,DadsUpLate,DadsUpLate,1872,2171,"I stopped drinking Budweiser when I was like 24 and discovered better beers. Now, I might go buy some. #BoycottStupidity",6,2,2017
https://twitter.com/Lagniappism/status/828624121516920837,2017-02-06 15:19:20+00:00,828624121516920837,Am I really gonna have to start drinking Budweiser to show my support  Will these indignities never end,1,0,5,Lagniappism,SAINT BERNAVVD,1510,2001,"Am I really gonna have to start drinking Budweiser to show my support

Will these indignities never end",6,2,2017
https://twitter.com/TommyIgoe/status/828624017242230786,2017-02-06 15:18:55+00:00,828624017242230786,#Budweiser is terrible beer but #respect for this.   Boycotting Budweiser Over Super Bowl Commercial https://t.co/hhICDGe7N4 via @22Words,2,1,7,TommyIgoe,Tommy Igoe,12106,811,"#Budweiser is terrible beer but #respect for this. 

Boycotting Budweiser Over Super Bowl Commercial twentytwowords.com/rump-supporter… via @22Words",6,2,2017
https://twitter.com/harrypav/status/828623857871384576,2017-02-06 15:18:17+00:00,828623857871384576,(facepalming) at least spell Budweiser correctly if you're going to boycott it,1,0,5,harrypav,"Harry Pavlidis, one dog, a peacock, and no apple.",9974,1053,(facepalming) at least spell Budweiser correctly if you're going to boycott it,6,2,2017
https://twitter.com/bannedlibrary/status/828623514135646211,2017-02-06 15:16:55+00:00,828623514135646211,"The library might just buy Budweiser. We won't drink it, but we'll support even the sideways idea that diversity made this country great.",1,0,5,bannedlibrary,Banned Library,13500,7948,"The library might just buy Budweiser. We won't drink it, but we'll support even the sideways idea that diversity made this country great.",6,2,2017
https://twitter.com/DArm91/status/828623211231326208,2017-02-06 15:15:43+00:00,828623211231326208,So #boycottbudwiser is trending.  I have  no idea what this Budwiser is.  I know what Budweiser is but not this Budwiser you guys speak of,1,1,4,DArm91,x - Darcy Armstrong,5762,6337,So #boycottbudwiser is trending.  I have  no idea what this Budwiser is.  I know what Budweiser is but not this Budwiser you guys speak of,6,2,2017
https://twitter.com/AnnieWT/status/828623043190784000,2017-02-06 15:15:03+00:00,828623043190784000,"If you didn't like that ""factual"" commercial then get the hell out of America! BTW, you spelled Budweiser wrong morons #boycottbudwiser",2,0,1,AnnieWT,AnnieT,2821,2574,"If you didn't like that ""factual"" commercial then get the hell out of America! BTW, you spelled Budweiser wrong morons #boycottbudwiser",6,2,2017
https://twitter.com/christofurchase/status/828622719407243264,2017-02-06 15:13:46+00:00,828622719407243264,"#boycottbudwiser: #Trump's paternal grandparents were German immigrants, so we should #BoycottTrump? And it's spelled @Budweiser. Morons.",1,0,3,christofurchase,Christopher Chase,262,0,"#boycottbudwiser: #Trump's paternal grandparents were German immigrants, so we should #BoycottTrump? And it's spelled @Budweiser. Morons.",6,2,2017
https://twitter.com/pomodrunkard/status/828622708569153538,2017-02-06 15:13:43+00:00,828622708569153538,"The enemy of my enemy is my friend, but that doesn't mean I'm suddenly going to start drinking Budweiser.",1,0,2,pomodrunkard,Stu,420,394,"The enemy of my enemy is my friend, but that doesn't mean I'm suddenly going to start drinking Budweiser.",6,2,2017
https://twitter.com/apokerplayer/status/828622529157685248,2017-02-06 15:13:00+00:00,828622529157685248,Was surprised at #Superbowl ad where ghost of Spuds McKenzie voiced his disgust w/ Trump administration. Way to go out on limb @budweiser.,1,1,1,apokerplayer,Zachary Elwood,14997,7732,Was surprised at #Superbowl ad where ghost of Spuds McKenzie voiced his disgust w/ Trump administration. Way to go out on limb @budweiser.,6,2,2017
https://twitter.com/haaretzcom/status/828622350111367169,2017-02-06 15:12:17+00:00,828622350111367169,ICYMI: WATCH: Budweiser's Pro-immigration Super Bowl Ad That Has Trump Supporters Tweeting #boycottbudwiser https://t.co/sBLti91yHn,4,1,6,haaretzcom,Haaretz.com,409729,1890,ICYMI: WATCH: Budweiser's Pro-immigration Super Bowl Ad That Has Trump Supporters Tweeting #boycottbudwiser haaretz.com/us-news/1.7697…,6,2,2017
https://twitter.com/exmormon/status/828621972141584384,2017-02-06 15:10:47+00:00,828621972141584384,"Just discovered that one of my die-hard #MORMON brothers &amp; leader of the High Priests,is now employed at @Budweiser..I laughed my ass off!😂🍻",2,0,4,exmormon,EX-MORMON,2470,1890,"Just discovered that one of my die-hard #MORMON brothers &amp; leader of the High Priests,is now employed at @Budweiser..I laughed my ass off!😂🍻",6,2,2017
https://twitter.com/USATODAY/status/828621755401043968,2017-02-06 15:09:56+00:00,828621755401043968,#BoycottBudweiser? Budweiser's Super Bowl ad sparks immigrant debate: https://t.co/x5I1uINISY #AdMeter https://t.co/8yR9HkLuRY,17,14,40,USATODAY,USA TODAY,4731752,914,#BoycottBudweiser? Budweiser's Super Bowl ad sparks immigrant debate: usat.ly/2kD7wmI #AdMeter https://t.co/8yR9HkLuRY,6,2,2017
https://twitter.com/DarkGreen_00/status/828621608210280452,2017-02-06 15:09:21+00:00,828621608210280452,"I don't drink beer, but after SB51 commercial I support you @Budweiser! Let's show @realDonaldTrump how much support! #BuyBudweiser #TRUMP",2,0,3,DarkGreen_00,P R I N C E 🎖,25,250,"I don't drink beer, but after SB51 commercial I support you @Budweiser! Let's show @realDonaldTrump how much support! #BuyBudweiser #TRUMP",6,2,2017
https://twitter.com/FullBellyLaughs/status/828621363535568902,2017-02-06 15:08:22+00:00,828621363535568902,I #boycottbudwiser not because of the ads. Budweiser tastes like how Falcons fans feel.,11,0,13,FullBellyLaughs,Full Belly Laughs,877,56,I #boycottbudwiser not because of the ads. Budweiser tastes like how Falcons fans feel.,6,2,2017
https://twitter.com/pkrager5/status/828621120995782656,2017-02-06 15:07:24+00:00,828621120995782656,@BvrlyTweetmaker I believe that you need to drink @Budweiser while using @Airbnb and building something with @84LumberNews.,1,1,0,pkrager5,PK,108,695,@BvrlyTweetmaker I believe that you need to drink @Budweiser while using @Airbnb and building something with @84LumberNews.,6,2,2017
https://twitter.com/_NCPatriot_/status/828620943220154368,2017-02-06 15:06:42+00:00,828620943220154368,That Budweiser Super Bowl ad everyone is talking about is a LIE! https://t.co/MrFL3SyTSf via @twitchyteam,1,0,1,_NCPatriot_,= Linda🇺🇸Wray =,12065,12340,That Budweiser Super Bowl ad everyone is talking about is a LIE! twitchy.com/gregp-3534/201… via @twitchyteam,6,2,2017
https://twitter.com/Pundamentalism/status/828620766937743361,2017-02-06 15:06:00+00:00,828620766937743361,"Budweiser should just change their labels to say ""Bottle of Alt-Right Tears"".",13,1,49,Pundamentalism,Pundamentalism,107428,1018,"Budweiser should just change their labels to say ""Bottle of Alt-Right Tears"".",6,2,2017
https://twitter.com/BluegrassCap/status/828620440151134208,2017-02-06 15:04:42+00:00,828620440151134208,"""Digital content engagement around Budweiser has increased 606% since the brands Super Bowl advertisement first went online"" @Forbes",1,2,3,BluegrassCap,Bluegrass Capital,46049,394,"""Digital content engagement around Budweiser has increased 606% since the brands Super Bowl advertisement first went online"" @Forbes",6,2,2017
https://twitter.com/shondi99/status/828620265382764544,2017-02-06 15:04:00+00:00,828620265382764544,"Budweiser, Google, Coca-Cola Super Bowl ads send message to Trump: Screw you! - Palmer Report https://t.co/oXazsSBDQU",4,1,3,shondi99,shondi99 (4! VAXX and Masked by choice),21569,19554,"Budweiser, Google, Coca-Cola Super Bowl ads send message to Trump: Screw you! - Palmer Report palmerreport.com/opinion/budwei…",6,2,2017
https://twitter.com/ParkUniversity/status/828620021777694721,2017-02-06 15:03:02+00:00,828620021777694721,Assistant Professor of Marketing Toni Ford spoke to @KCTV5's @BetsyKCTV5 about marketing and the @Budweiser #SB51 ad https://t.co/Heebl9p7Um,2,0,2,ParkUniversity,Park University,5683,1056,"Assistant Professor of Marketing Toni Ford spoke to @KCTV5's @BetsyKCTV5 about marketing and the @Budweiser #SB51 ad
kctv5.com/clip/13078657/…",6,2,2017
https://twitter.com/SajdaMughal/status/828619792504459264,2017-02-06 15:02:08+00:00,828619792504459264,"As a non drinker, I gotta give it to @Budweiser for producing a brilliant ad especially in the current climate 🙌🏼🙌🏼🙌🏼👍🏼👍🏼 #BudweiserAD https://t.co/BcgiN70O6q",5,0,9,SajdaMughal,Sajda,4740,5207,"As a non drinker, I gotta give it to @Budweiser for producing a brilliant ad especially in the current climate 🙌🏼🙌🏼🙌🏼👍🏼👍🏼 #BudweiserAD twitter.com/cnn/status/827…",6,2,2017
