url,Datetime,Tweet Id,Text,Retweet Count,Reply Count,Like Count,Username,Display Name,Followers Count,Friends Count,Rendered Content,Day,Month,Year
https://twitter.com/gracielou173/status/828688333656166400,2017-02-06 19:34:29+00:00,828688333656166400,lol I can't watch any Budweiser puppy commercials cause I always end up crying 🙃😅,1,0,5,gracielou173,✨gracie ✨,695,278,lol I can't watch any Budweiser puppy commercials cause I always end up crying 🙃😅,6,2,2017
https://twitter.com/Clevelandpro65/status/828688141586399238,2017-02-06 19:33:43+00:00,828688141586399238,"Thanks for letting me know this. If it is successful as your other ""boycotts"",Starbucks... I'm off to buy BUDWEISER stock! #boycottbudwiser",6,1,22,Clevelandpro65,Robert Andrews,5243,5250,"Thanks for letting me know this. If it is successful as your other ""boycotts"",Starbucks... I'm off to buy BUDWEISER stock! #boycottbudwiser",6,2,2017
https://twitter.com/TheCW0218/status/828687676891082754,2017-02-06 19:31:53+00:00,828687676891082754,LT: Budweiser is being boycotted by Trump supp. for touching on the subject of immigration in their SB commercial. The # was spelled wrong,2,0,0,TheCW0218,Conger Wraase,28,39,LT: Budweiser is being boycotted by Trump supp. for touching on the subject of immigration in their SB commercial. The # was spelled wrong,6,2,2017
https://twitter.com/RebeccaRSolomon/status/828687378067886080,2017-02-06 19:30:41+00:00,828687378067886080,"#boycottbudweiser or #boycottbudwiser... @POTUS supporters #boycotting @Budweiser's immigration ad, but can't spell #Budweiser right..Yikes!",3,2,3,RebeccaRSolomon,RebeccaSolomonTV,2367,1194,"#boycottbudweiser or #boycottbudwiser... @POTUS supporters #boycotting @Budweiser's immigration ad, but can't spell #Budweiser right..Yikes!",6,2,2017
https://twitter.com/Kristan_Higgins/status/828687213168832516,2017-02-06 19:30:02+00:00,828687213168832516,"Things to do today: Buy Budweiser &amp; Coke (don't drink them,but hey). Rent AirBnB. Buy an Audi (? well, maybe someday). Buy some lumber.",2,4,44,Kristan_Higgins,Kristan🇺🇦Higgins,22797,3126,"Things to do today: Buy Budweiser &amp; Coke (don't drink them,but hey). Rent AirBnB. Buy an Audi (? well, maybe someday). Buy some lumber.",6,2,2017
https://twitter.com/Anomaly/status/828686940706856960,2017-02-06 19:28:57+00:00,828686940706856960,.@Budweiser Wins The Super Bowl 51 Brand Advertising Battle via @forbes https://t.co/sySfYHrY8g,2,0,10,Anomaly,Anomaly,25125,1332,.@Budweiser Wins The Super Bowl 51 Brand Advertising Battle via @forbes forbes.com/sites/darrenhe…,6,2,2017
https://twitter.com/TheCW0218/status/828686897614577664,2017-02-06 19:28:47+00:00,828686897614577664,"Budweiser was founded in 1876 in the USA. It is spelled with an e, and has dozens of breweries in the US. #HIST100MWF #boycottbudwiser",1,1,0,TheCW0218,Conger Wraase,28,39,"Budweiser was founded in 1876 in the USA. It is spelled with an e, and has dozens of breweries in the US. #HIST100MWF #boycottbudwiser",6,2,2017
https://twitter.com/MBarwinksi/status/828686300689625090,2017-02-06 19:26:24+00:00,828686300689625090,"Watching SNL with a Coke in one hand, Budweiser in the other, while I make a reservation with Air B&amp;B! 😂 #boycottbudwiser",14,2,83,MBarwinksi,Maureen B,85,339,"Watching SNL with a Coke in one hand, Budweiser in the other, while I make a reservation with Air B&amp;B! 😂 #boycottbudwiser",6,2,2017
https://twitter.com/kristincognito/status/828686274223484930,2017-02-06 19:26:18+00:00,828686274223484930,"A3: I think @Budweiser's immigrant ad was super creative, while @BuschBeer's spot was a hilarious brand update! #PromaxBDA",1,0,1,kristincognito,The Craiken🐙,475,469,"A3: I think @Budweiser's immigrant ad was super creative, while @BuschBeer's spot was a hilarious brand update! #PromaxBDA",6,2,2017
https://twitter.com/jusdavee/status/828685509404872707,2017-02-06 19:23:16+00:00,828685509404872707,I thought that Budweiser commercial was the trailer for Peaky Blinders Season 5...,1,0,2,jusdavee,JusDave,1687,574,I thought that Budweiser commercial was the trailer for Peaky Blinders Season 5...,6,2,2017
https://twitter.com/OpRodeo_/status/828685461497405440,2017-02-06 19:23:04+00:00,828685461497405440,.@Budweiser sponsor #rodeo #AnimalCruelty END barbaric America tradition! #OpRodeo #AnimalLiberation https://t.co/j50aTHxDkF,5,0,1,OpRodeo_,#OpRodeo Ⓥ🍀,1328,1229,".@Budweiser sponsor #rodeo #AnimalCruelty
END barbaric America tradition! #OpRodeo #AnimalLiberation https://t.co/j50aTHxDkF",6,2,2017
https://twitter.com/joseph_ippolito/status/828685173994631168,2017-02-06 19:21:56+00:00,828685173994631168,Hanging out with my Super Bowl horse friends the Budweiser Clydesdales - YouTube https://t.co/MhwsEoL4jQ,1,0,0,joseph_ippolito,Sync Media Network,415,549,Hanging out with my Super Bowl horse friends the Budweiser Clydesdales - YouTube stfi.re/yxjewxr,6,2,2017
https://twitter.com/7NewsDC/status/828685115681292290,2017-02-06 19:21:42+00:00,828685115681292290,Budweiser's Super Bowl ad prompted calls for a boycott. But the hashtag was spelled wrong: https://t.co/KlTfYxospK https://t.co/2ZJ6mS8AQT,2,0,2,7NewsDC,7News DC,177685,1366,Budweiser's Super Bowl ad prompted calls for a boycott. But the hashtag was spelled wrong: circa.com/circa-now/tren… https://t.co/2ZJ6mS8AQT,6,2,2017
https://twitter.com/superthumbs001/status/828684924194607104,2017-02-06 19:20:56+00:00,828684924194607104,@carling @Budweiser @MagnersUK @thatchers_cider Plz R/T to raise a Glass to @justiceforBigAl as his fight for freedom starts tomorrow https://t.co/wipCJLM6Qb,10,0,10,superthumbs001,Ad-rain Dangermouse,1524,756,@carling @Budweiser @MagnersUK @thatchers_cider Plz R/T to raise a Glass to @justiceforBigAl as his fight for freedom starts tomorrow https://t.co/wipCJLM6Qb,6,2,2017
https://twitter.com/Brewed_Culture/status/828684666043498496,2017-02-06 19:19:55+00:00,828684666043498496,"Interviewed with @smerconish today on Sirius XM radio about 1850s beer, German immigration, and the Budweiser ad: https://t.co/TPRb28RsZn",2,0,3,Brewed_Culture,Brian Alberts,1198,1250,"Interviewed with @smerconish today on Sirius XM radio about 1850s beer, German immigration, and the Budweiser ad: bit.ly/2jUP0Xp",6,2,2017
https://twitter.com/AddInfoOrg/status/828684525437857794,2017-02-06 19:19:21+00:00,828684525437857794,The World Is Laughing At Conservatives For Their Hilariously Misspelled Budweiser… https://t.co/lKMpsrTDZH https://t.co/kMVcdiYuup,18,1,19,AddInfoOrg,Matthew,24685,1091,The World Is Laughing At Conservatives For Their Hilariously Misspelled Budweiser… author.addictinginfo.org/2017/02/06/the… https://t.co/kMVcdiYuup,6,2,2017
https://twitter.com/PatC9494/status/828684411918954496,2017-02-06 19:18:54+00:00,828684411918954496,How dare Budweiser air a commercial telling the story of how their founders moved to America and started a successful company...,1,0,2,PatC9494,Patryk AKA José Blanco,203,447,How dare Budweiser air a commercial telling the story of how their founders moved to America and started a successful company...,6,2,2017
https://twitter.com/travismcelroy/status/828684383896887296,2017-02-06 19:18:47+00:00,828684383896887296,"I know I've been campaigning to be the face of Champagne (#champagencampaign) in 2017, but I'd be happy to do some spots for @Budweiser too?",2,2,72,travismcelroy,"Travis McElroy, The Internet's Best Friend",273421,1873,"I know I've been campaigning to be the face of Champagne (#champagencampaign) in 2017, but I'd be happy to do some spots for @Budweiser too?",6,2,2017
https://twitter.com/martechismktg/status/828684105852342272,2017-02-06 19:17:41+00:00,828684105852342272,Top 10 Most Shared Super Bowl LI Ads: Budweiser’s immigration story shared more than any other ad by @AmyGesenhues https://t.co/euMYx4UvNc,4,1,2,martechismktg,MarTech,206265,1006,Top 10 Most Shared Super Bowl LI Ads: Budweiser’s immigration story shared more than any other ad by @AmyGesenhues mklnd.com/2lgr4Ki,6,2,2017
https://twitter.com/stelala8/status/828683391826481153,2017-02-06 19:14:51+00:00,828683391826481153,People boycotting @CocaCola and @Budweiser don't worry... people like myself who don't normally drink it have been inspired to start. 🤗,2,0,4,stelala8,Stela✶,438,255,People boycotting @CocaCola and @Budweiser don't worry... people like myself who don't normally drink it have been inspired to start. 🤗,6,2,2017
https://twitter.com/mytraveltails/status/828683389708431360,2017-02-06 19:14:50+00:00,828683389708431360,"If @Audi made a truck, I'd use it to haul my @84LumberNews. Then I would sit on my tailgate and drink a @Budweiser!",1,0,2,mytraveltails,My Travel Tails,196,269,"If @Audi made a truck, I'd use it to haul my @84LumberNews. Then I would sit on my tailgate and drink a @Budweiser!",6,2,2017
https://twitter.com/Adweek/status/828683086342868992,2017-02-06 19:13:38+00:00,828683086342868992,#AdweekChat's favorite #SB51 ads.  Sincere: - Audi - 84 Lumber - Airbnb - Budweiser  Funny: - Avocados - Bai - Skittles - Mr. Clean,86,7,183,Adweek,Adweek,688977,26488,"#AdweekChat's favorite #SB51 ads.

Sincere:
- Audi
- 84 Lumber
- Airbnb
- Budweiser

Funny:
- Avocados
- Bai
- Skittles
- Mr. Clean",6,2,2017
https://twitter.com/TRUTH_TWEETERS/status/828682938879528961,2017-02-06 19:13:03+00:00,828682938879528961,"@frangeladuo @Starbucks @lyft @Budweiser @KelloggsUS @ladygaga @SMShow :BTW, HOW EMBARRASSING CAN #BLOTUS GET: https://t.co/QGX1Sp4wai",1,0,0,TRUTH_TWEETERS,(((TRUTH_TWEETERS))),4959,5931,"@frangeladuo @Starbucks @lyft @Budweiser @KelloggsUS @ladygaga @SMShow :BTW, HOW EMBARRASSING CAN #BLOTUS GET: independent.co.uk/news/uk/politi…",6,2,2017
https://twitter.com/IdeasCollide/status/828682533520879616,2017-02-06 19:11:26+00:00,828682533520879616,"A1: @Audi, 84 Lumber and @Budweiser all delivered well-crafted political messages. But it's hard to say no to Mr. Clean's moves. #adweekchat",1,0,1,IdeasCollide,Ideas Collide,1129,793,"A1: @Audi, 84 Lumber and @Budweiser all delivered well-crafted political messages. But it's hard to say no to Mr. Clean's moves. #adweekchat",6,2,2017
https://twitter.com/travismcelroy/status/828682191760670720,2017-02-06 19:10:05+00:00,828682191760670720,"For real though? Haven't had a @Budweiser in forever and it's really hitting the spot. This Bud, is in fact, for me.",2,7,118,travismcelroy,"Travis McElroy, The Internet's Best Friend",273421,1873,"For real though? Haven't had a @Budweiser in forever and it's really hitting the spot. This Bud, is in fact, for me.",6,2,2017
https://twitter.com/Swashbucko/status/828682168020856832,2017-02-06 19:09:59+00:00,828682168020856832,How did 2017 become the year fighting Nazis means watching SNL &amp; drinking Budweiser,29,5,97,Swashbucko,Nathan Hart,8212,81,How did 2017 become the year fighting Nazis means watching SNL &amp; drinking Budweiser,6,2,2017
https://twitter.com/DarcyDoo76/status/828681910733897729,2017-02-06 19:08:58+00:00,828681910733897729,Going out to buy some #Budweiser immediately https://t.co/JxZL4Q6jqo,1,0,2,DarcyDoo76,DarcyDoo 🪴,308,565,Going out to buy some #Budweiser immediately twitter.com/businessinside…,6,2,2017
https://twitter.com/WinstonsWrath/status/828681851300696067,2017-02-06 19:08:44+00:00,828681851300696067,Trumpflakes are literally boycotting their own ancestors bc @Budweiser reminded them that we were all immigrants once #boycottbudwiser,35,5,133,WinstonsWrath,Winston's Wrath,60,301,Trumpflakes are literally boycotting their own ancestors bc @Budweiser reminded them that we were all immigrants once #boycottbudwiser,6,2,2017
https://twitter.com/MClarissa/status/828681805121335300,2017-02-06 19:08:33+00:00,828681805121335300,I smoke weed but i will now buy @Budweiser products 4 my buds that drink brews. I support antiTrump biz. Gramma fled Nazi Germ. Im 2nd genUS,1,0,2,MClarissa,MClarissa,14830,13492,"I smoke weed but i will now buy @Budweiser products 4 my buds that drink brews. I support antiTrump biz.
Gramma fled Nazi Germ. Im 2nd genUS",6,2,2017
https://twitter.com/russrankinNJD/status/828681374034849792,2017-02-06 19:06:50+00:00,828681374034849792,"Trump supporters tweeting to boycott Budweiser, but misspelling Budweiser in their hashtag, is the Trumpiest Trump supporter thing ever",1,2,13,russrankinNJD,Russ Rankin,3186,368,"Trump supporters tweeting to boycott Budweiser, but misspelling Budweiser in their hashtag, is the Trumpiest Trump supporter thing ever",6,2,2017
https://twitter.com/BigSean/status/828680690057228288,2017-02-06 19:04:07+00:00,828680690057228288,More photos from the Rolling Stone x @Budweiser party last weekend. https://t.co/ndKh4HkxfV https://t.co/kqQiyBrWkE,192,13,1001,BigSean,Sean Don,14251162,2187,More photos from the Rolling Stone x @Budweiser party last weekend. rollingstone.com/music/pictures… https://t.co/kqQiyBrWkE,6,2,2017
https://twitter.com/ZippydoodaJr/status/828679763392884736,2017-02-06 19:00:26+00:00,828679763392884736,Me:  That does it!  I’m never drinking Budweiser again!  Passerby: Because of a commercial?  Me: No!  I just tasted Budweiser!,5,0,20,ZippydoodaJr,Eldercare Dropout,86,61,"Me:  That does it!  I’m never drinking Budweiser again!

Passerby: Because of a commercial?

Me: No!  I just tasted Budweiser!",6,2,2017
https://twitter.com/absolutelyenuff/status/828679712591462400,2017-02-06 19:00:14+00:00,828679712591462400,"...in protest I hereby swear, along with the rest of the logical world, to completely support @Budweiser &amp; other @AnheuserBusch products https://t.co/CQj1W9eZ0f",1,0,1,absolutelyenuff,ForeverBlue🌊🌊🌊,4376,4964,"...in protest I hereby swear, along with the rest of the logical world, to completely support @Budweiser &amp; other @AnheuserBusch products twitter.com/art2u2/status/…",6,2,2017
https://twitter.com/KVOA/status/828679578688376833,2017-02-06 18:59:42+00:00,828679578688376833,"#SuperBowl ads normally avoid politics, but not this year - @Airbnb, @Budweiser, @84LumberNews court controversy https://t.co/OquumlUHiE https://t.co/Z3edcLJKSI",1,0,0,KVOA,KVOA News 4 Tucson,84181,1611,"#SuperBowl ads normally avoid politics, but not this year - @Airbnb, @Budweiser, @84LumberNews court controversy kvoa.com/story/34430939… https://t.co/Z3edcLJKSI",6,2,2017
https://twitter.com/Ramble__on/status/828679496987447296,2017-02-06 18:59:22+00:00,828679496987447296,#boycottbudwiser ....it's Budweiser... https://t.co/vGq6DyAZhF,5,0,18,Ramble__on,Nicole,4494,604,#boycottbudwiser ....it's Budweiser... https://t.co/vGq6DyAZhF,6,2,2017
https://twitter.com/youlivethrice/status/828679349675057152,2017-02-06 18:58:47+00:00,828679349675057152,"Budweiser doesn't understand that immigrants of the past are VASTLY different from those of today. America was loved then, now hated. https://t.co/lSnMneLnW5",45,19,67,youlivethrice,🔴UpTownGirl🔴,40363,27608,"Budweiser doesn't understand that immigrants of the past are VASTLY different from those of today. America was loved then, now hated. twitter.com/CinCin0211/sta…",6,2,2017
https://twitter.com/Kitkatpatriot/status/828679301461635073,2017-02-06 18:58:36+00:00,828679301461635073,Bahahaha! Patriots will always win in the end! And I'm not referring to a football team! Boycott Budweiser &amp; 84 lumber instead! https://t.co/c3U5BWjqbv,1,0,1,Kitkatpatriot,Kat Morris,1523,1620,Bahahaha! Patriots will always win in the end! And I'm not referring to a football team! Boycott Budweiser &amp; 84 lumber instead! twitter.com/stevenwhirsch9…,6,2,2017
https://twitter.com/jetblast37/status/828679203902070784,2017-02-06 18:58:12+00:00,828679203902070784,"So, #boycottbudwiser is trending among Trump supporters. Notice, Budweiser is misspelled. Need I say more? 😂",1,1,0,jetblast37,Brayden,78,459,"So, #boycottbudwiser is trending among Trump supporters. Notice, Budweiser is misspelled. Need I say more? 😂",6,2,2017
https://twitter.com/BunnyWatsonLib/status/828679138659749890,2017-02-06 18:57:57+00:00,828679138659749890,@yalielkin @JustinRWalton @WretchedEsq @Budweiser @davidharsanyi The point at which you may legally purchase your own alcohol.,1,0,1,BunnyWatsonLib,Bunny Watson,167,337,@yalielkin @JustinRWalton @WretchedEsq @Budweiser @davidharsanyi The point at which you may legally purchase your own alcohol.,6,2,2017
https://twitter.com/MattStout07/status/828678935114371074,2017-02-06 18:57:08+00:00,828678935114371074,"Trump Supporters got #boycottbudwiser trending, but they can't even spell #Budweiser right?? Seriously?? #SMDH",39,5,171,MattStout07,Matt Stout-McKnight,132853,134814,"Trump Supporters got #boycottbudwiser trending, but they can't even spell #Budweiser right?? Seriously?? #SMDH",6,2,2017
https://twitter.com/MichaelJPetty/status/828678897390608384,2017-02-06 18:56:59+00:00,828678897390608384,People are boycotting Budweiser due to commercial? Here I've been boycotting it since 17 because it tastes like piss.,2,2,5,MichaelJPetty,Manech,805,876,"People are boycotting Budweiser due to commercial?
Here I've been boycotting it since 17 because it tastes like piss.",6,2,2017
https://twitter.com/disney_wench/status/828678666498560004,2017-02-06 18:56:04+00:00,828678666498560004,"#boycottbudwiser yeah! Let's boycott Budwiser (whatever that is), not to be mistaken with the delicious beer BUDWEISER 🍺",1,0,1,disney_wench,Rachel,1765,1026,"#boycottbudwiser yeah! Let's boycott Budwiser (whatever that is), not to be mistaken with the delicious beer BUDWEISER 🍺",6,2,2017
https://twitter.com/Fredzipfel/status/828678149596667904,2017-02-06 18:54:01+00:00,828678149596667904,"When I want a thin insipid adjunct lager, I'll always take rice adjunct (Budweiser), over corn syrup adjunct (Miller, Coors, Stella Artois)",3,2,12,Fredzipfel,Recovering Soy Boy,8050,4452,"When I want a thin insipid adjunct lager, I'll always take rice adjunct (Budweiser), over corn syrup adjunct (Miller, Coors, Stella Artois)",6,2,2017
https://twitter.com/cinnamatron/status/828677999637708802,2017-02-06 18:53:25+00:00,828677999637708802,"Hey #boycottbudwiser people: you do know Budweiser is a foreign owned beer company, right? What have you been waiting for??",11,2,34,cinnamatron,Bryan,595,1202,"Hey #boycottbudwiser people: you do know Budweiser is a foreign owned beer company, right? What have you been waiting for??",6,2,2017
https://twitter.com/ChachiAngelo/status/828677932822458368,2017-02-06 18:53:09+00:00,828677932822458368,"You don't HAVE to boycott @Budweiser ... I mean, if you want to tell the world you don't have taste buds, that's your choice.",1,0,0,ChachiAngelo,Chachi,1258,830,"You don't HAVE to boycott @Budweiser ... I mean, if you want to tell the world you don't have taste buds, that's your choice.",6,2,2017
https://twitter.com/TheEvanJohan/status/828677436468457472,2017-02-06 18:51:11+00:00,828677436468457472,Are they boycotting Budweiser or spelling? #Boycottspelling #boycottbudwiser,15,2,56,TheEvanJohan,Evan Mathiasen,41,151,Are they boycotting Budweiser or spelling? #Boycottspelling #boycottbudwiser,6,2,2017
https://twitter.com/ArtsyPabster/status/828677119341236226,2017-02-06 18:49:55+00:00,828677119341236226,"Haha good luck boycotting Budweiser, which is owned by Anheuser-Busch, who basically owns half of the beers sold out there. Oh you guys...",1,3,14,ArtsyPabster,Pablo Leon,19863,1204,"Haha good luck boycotting Budweiser, which is owned by Anheuser-Busch, who basically owns half of the beers sold out there. Oh you guys...",6,2,2017
https://twitter.com/navnoova/status/828677041033654272,2017-02-06 18:49:37+00:00,828677041033654272,"I don't drink, but I'll happily buy someone a beer this week. 🍻 @Budweiser #MuslimSupportingBudweiser #boycottbudwiser #IdiotsCantSpell",1,0,5,navnoova,NR,155,287,"I don't drink, but I'll happily buy someone a beer this week. 🍻 @Budweiser #MuslimSupportingBudweiser #boycottbudwiser #IdiotsCantSpell",6,2,2017
https://twitter.com/repub9989/status/828677040949850112,2017-02-06 18:49:37+00:00,828677040949850112,@DLoesch i didn't get why people on the right were made at the Budweiser ad of Busch immigrating from Germany LEGALLY,3,7,21,repub9989,Charles,3591,1943,@DLoesch i didn't get why people on the right were made at the Budweiser ad of Busch immigrating from Germany LEGALLY,6,2,2017
https://twitter.com/homoah/status/828676771981697024,2017-02-06 18:48:33+00:00,828676771981697024,Me: I hate beer Racists: lets boycott Budweiser  Me: https://t.co/u3Y4dYuwWf,3,0,9,homoah,noah,532,381,"Me: I hate beer
Racists: lets boycott Budweiser 
Me: https://t.co/u3Y4dYuwWf",6,2,2017
https://twitter.com/NoMelodramama/status/828676727480033280,2017-02-06 18:48:22+00:00,828676727480033280,Last night we saw a #comeback like no other. Congratulations @Audi @84LumberNews @Airbnb @CocaCola &amp; @Budweiser. Last night #equality won.,1,0,1,NoMelodramama,NoMelodramama,329,594,Last night we saw a #comeback like no other. Congratulations @Audi @84LumberNews @Airbnb @CocaCola &amp; @Budweiser. Last night #equality won.,6,2,2017
https://twitter.com/mashable/status/828676654167945216,2017-02-06 18:48:05+00:00,828676654167945216,The boycott Budweiser campaign fell apart due to a spelling mistake and a misunderstanding https://t.co/CNbW3mxbI4 https://t.co/Q3RSM0PcFb,56,12,132,mashable,Mashable,9427484,2737,The boycott Budweiser campaign fell apart due to a spelling mistake and a misunderstanding on.mash.to/2lgmzQe https://t.co/Q3RSM0PcFb,6,2,2017
https://twitter.com/keaneli/status/828676640691458048,2017-02-06 18:48:01+00:00,828676640691458048,Trump supporters should be praising @Budweiser's ad. The guy came here LEGALLY and gave America BEER. Dum-dums! #BoycottBudweiser,2,2,5,keaneli,Keane Li,4166,675,Trump supporters should be praising @Budweiser's ad. The guy came here LEGALLY and gave America BEER. Dum-dums! #BoycottBudweiser,6,2,2017
https://twitter.com/travismcelroy/status/828676214252568582,2017-02-06 18:46:20+00:00,828676214252568582,"How DARE Budweiser try to pretend like immigrants have come to our country, had a rough reception, but inevitably contributed a great deal!",63,7,494,travismcelroy,"Travis McElroy, The Internet's Best Friend",273421,1873,"How DARE Budweiser try to pretend like immigrants have come to our country, had a rough reception, but inevitably contributed a great deal!",6,2,2017
https://twitter.com/nstretcher/status/828676157960765440,2017-02-06 18:46:06+00:00,828676157960765440,OK you all know what this means.  I'm headed out to buy some @Budweiser and I don't even drink beer. Let's #UnboycottBudweiser https://t.co/Jsoc2CR30b,1,0,4,nstretcher,MyDogIsExhausted,15490,14418,OK you all know what this means.  I'm headed out to buy some @Budweiser and I don't even drink beer. Let's #UnboycottBudweiser twitter.com/esheikh_/statu…,6,2,2017
https://twitter.com/youlivethrice/status/828675914250625024,2017-02-06 18:45:08+00:00,828675914250625024,https://t.co/pBqi8eIyWC - It makes no sense to allow unlimited numbers of immigrants into ANY country. Budweiser's ad was so yesterday.,5,2,10,youlivethrice,🔴UpTownGirl🔴,40363,27608,google.com/amp/www.bbc.co… - It makes no sense to allow unlimited numbers of immigrants into ANY country. Budweiser's ad was so yesterday.,6,2,2017
https://twitter.com/bravogranny/status/828675770922868736,2017-02-06 18:44:34+00:00,828675770922868736,"Budweiser’s Pro-Immigrant Super Bowl Ad Is ‘Mostly Fiction,’ Anheuser-Busch Expert Says https://t.co/21dp5QSLnd",2,2,4,bravogranny,#Ban Sharia Law,209,79,"Budweiser’s Pro-Immigrant Super Bowl Ad Is ‘Mostly Fiction,’ Anheuser-Busch Expert Says twitter.com/AnnCoulter/sta…",6,2,2017
https://twitter.com/ElkoExpress/status/828675668762296320,2017-02-06 18:44:10+00:00,828675668762296320,5th annual Budweiser Classic is all set! 🇺🇸⚾️☀️🍺 https://t.co/0GIn3zJv19,9,0,8,ElkoExpress,⚾️Elko Express⚾️,774,619,5th annual Budweiser Classic is all set! 🇺🇸⚾️☀️🍺 https://t.co/0GIn3zJv19,6,2,2017
https://twitter.com/TerranEmpire/status/828675411529838596,2017-02-06 18:43:08+00:00,828675411529838596,@EW It's a pro-crminal behavior ILLEGAL IMMIGRATION ad not a LEGAL IMMIGRATION ad like the @Budweiser ad was.,1,0,2,TerranEmpire,J. N. Buck,308,1256,@EW It's a pro-crminal behavior ILLEGAL IMMIGRATION ad not a LEGAL IMMIGRATION ad like the @Budweiser ad was.,6,2,2017
https://twitter.com/CaptFacetious/status/828675222710595585,2017-02-06 18:42:23+00:00,828675222710595585,"Okay, I'll #boycottbudwiser if you want.  BudWEISER, however, is still on the menu.",1,0,2,CaptFacetious,Wes W,9749,10016,"Okay, I'll #boycottbudwiser if you want.

BudWEISER, however, is still on the menu.",6,2,2017
https://twitter.com/DAvallone/status/828675177273712640,2017-02-06 18:42:12+00:00,828675177273712640,"To Dems saying ""reach out to Trump voters"": Coca Cola and Budweiser aren't afraid of pissing them off. What do they know that you don't?",3,0,11,DAvallone,David Avallone,10834,6097,"To Dems saying ""reach out to Trump voters"": Coca Cola and Budweiser aren't afraid of pissing them off. What do they know that you don't?",6,2,2017
https://twitter.com/DLMEsquire/status/828675167962415109,2017-02-06 18:42:10+00:00,828675167962415109,"Budweiser message: Look how Great our American Immigrant Founders are Meanwhile, Budweiser NO LONGER an American Company! #boycottbudwiser",1,0,1,DLMEsquire,DLM,1139,3027,"Budweiser message: Look how Great our American Immigrant Founders are Meanwhile, Budweiser NO LONGER an American Company! #boycottbudwiser",6,2,2017
https://twitter.com/PRWeekUS/status/828675160316186626,2017-02-06 18:42:08+00:00,828675160316186626,PR pros: Budweiser's controversial Super Bowl ad a prime example of bold storytelling https://t.co/e6qnHM3loT https://t.co/WGutlifZQX,10,0,10,PRWeekUS,PRWeekUS,86745,2379,PR pros: Budweiser's controversial Super Bowl ad a prime example of bold storytelling prweek.com/article/142346… https://t.co/WGutlifZQX,6,2,2017
